Artists,Name,Date,Genre,Writing.Credits,Features
"Corbin Bleu, Lucas Grabeel",I Don't Dance,14-Aug-07,"Disney,Soundtrack,Pop","Robbie nevil, Matthew gerrard",
"Ashley Tisdale, Lucas Grabeel",Fabulous,14-Aug-07,"Disney,Soundtrack,Pop","Faye greenberg, David lawrence, Robbie nevil, Matthew gerrard",
Mario,How Do I Breathe,22-Feb-08,"R&;B,Rap","Mario, Phil jackson, Stargate",
Keith Urban,I Told You So,,"Country,Rock",Keith urban,
Craig Morgan,Tough,31-Oct-06,Country,"Monty criswell, Joe leathers",
Tracy Lawrence,Find Out Who Your Friends Are,,Country,,
The White Stripes,Icky Thump,26-Apr-07,"Alternative Rock,Protest Songs,Blues,Garage Punk,Pop-Rock,Rock,Pop",Jack white,
Avril Lavigne,Girlfriend,27-Feb-07,"Pop-Rock,Pop-Punk,Canada,Pop","Dr luke, Avril lavigne",
Lloyd,Get It Shawty,13-Mar-07,"Pop,R&;B,Rap","Zak wallace, Lloyd polite, James jlack lackey, Ryon lovett",
Kelly Clarkson,Never Again,24-Apr-04,"Glam Rock,Pop,Rock","Jimmy messer, Kelly clarkson",
Chris Brown,Wall To Wall,29-May-07,"DMV,Rap,Pop","Great scott, Sean garrett, Chris brown",
Montgomery Gentry,Lucky Man,29-Jan-07,Country,"Dave turnbull, David lee",
Lil Mama,Lip Gloss,5-Jun-07,Rap,"James groove chambers, Lil mama",
Kellie Pickler,I Wonder,5-Feb-07,"Country,Rock","Karen rochelle, Aimee mayo, Chris lindsey, Kellie pickler",
Brad Paisley,Ticks,19-Jun-07,"Country,Rock","Kelley lovelace, Tim owens, Brad paisley",
Timbaland,Give It To Me,6-Feb-07,"Beef,Portugal,Canada,West Coast,Dance-Pop,Dance,R&;B,Electro-Pop,Electro,Pop,Rap","Attitude, Timbaland, Danja, Nelly furtado, Justin timberlake","Nelly Furtado, Justin"
"Big, Rich",Lost In This Moment,19-Feb-07,Country,"John rich, Rodney clawson, Keith anderson",
Kelly Rowland,Like This,13-Mar-07,"R&;B,Rock","Blac elvis, Kelly rowland, Sean garrett, Eve, Polow da don, Jason perry",Eve
Jason Aldean,Johnny Cash,5-Feb-07,Country,"John rich, Vicky mcgehee, Rodney clawson",
Emerson Drive,Moments,27-Nov-07,Country,"Sam tate, Annie tate, Dave berg",
George Strait,Wrapped,,"Country,Rock",Bruce robison,
Huey,"Pop, Lock & Drop It",26-Sep-06,Rap,"C miller, D smith, Huey",
Fergie,Glamorous,13-Sep-06,"Hip-Hop,R&;B,Pop,Rap","Blac elvis, Ludacris, Fergie, William, Polow da don",Ludacris
Bone Thugs,I Tried,12-Feb-07,Rap,"Akon, Layzie bone, Krayzie bone, Wish bone",
Bobby Valentino,Anonymous,9-Apr-07,"R&;B,Rap","J roc, Bobby v, Timbaland",Timbaland
Papa Roach,Forever,12-Sep-06,Rock,"Jerry horton, Dave buckner, Tobin esperance, Jacoby shaddix",
Jake Owen,Startin' With Me,25-Jul-06,"Country,R&;B,Rock","Jake owen, Kendell marvel, Jimmy ritchey",
Hannah Montana,Nobody's Perfect,15-May-07,"Disney,Soundtrack,Pop","Robbie nevil, Matthew gerrard",
Tank,Please Don't Go,1-May-07,R&;B,"Charles bereal, Tank",
Hannah Montana,Life's What You Make It,9-Jun-07,"Disney,Soundtrack,Pop","Robbie nevil, Matthew gerrard",
Billy Currington,Good Directions,18-Oct-05,"Country,Rock",,
DJ Khaled,We Takin' Over,27-Mar-07,Rap,"Danjah, Timbaland, Rick ross, Ti, Lil wayne, Birdman, Fat joe","T.I., Akon, Rick Ross, Fat Joe, Lil' Wayne, Baby"
Goo Goo Dolls,Before It's Too Late,,Rock,,
Hilary Duff,Stranger,21-Mar-07,Pop,"Julius diaz, Vada nobles, Derrick haruin, Hilary duff, Kara dioguardi",
Ne,Because Of You,1-Jan-07,R&;B,"Mikkel storleer eriksen, Ne yo, Tor erik hermansen",
Ciara,Like A Boy,13-Feb-07,"Rap,R&;B","Ciara, Candice nelson, Balewa muhammad, Calvo da gr8, Ezekiel lewis, Patrick j que smith",
Hinder,Better Than Me,6-Feb-07,Rock,"Hinder, Brian howes",
"Beyonce, Shakira",Beautiful Liar,12-Feb-07,"Latin Pop,R&;B,Pop","Mikkel storleer eriksen, Beyonce, Ian dench, Amanda ghost, Tor erik hermansen",
Rob Thomas,Little Wonders,13-Mar-07,"Soundtrack,Pop",Rob thomas,
Bow Wow,Outta My System,13-Feb-07,Rap,"Rick james, Johnta austin, Jermaine dupri, T pain",T
Eric Church,Guys Like Me,,"Country,Rock",,
Miley Cyrus,G.N.O.,27-Jun-07,"Soundtrack,Pop",Nicole werth,
Unk,2 Step,5-Jun-07,Rap,,
R. Kelly Or Bow Wow,I'm A Flirt,,Rap,"T pain, R kelly",
Paul McCartney,Dance Tonight,4-Jun-07,Rock,Paul mccartney,
Hannah Montana,Make Some Noise,26-Jun-07,"Disney,Soundtrack,Pop","Adam watts, Andy dodd",
Faith Hill,Lost,,Pop,,
Hannah Montana,True Friend,26-Jun-07,"Disney,Soundtrack,Pop",Jeannie lurie,
Rascal Flatts,Stand,22-Jan-07,"Country,Rock","Blair daly, Danny orton",
Mims,This Is Why I'm Hot,23-Jan-07,"Crunk,Rap","Blackout producer, Danny boy styles, Thomas simons, Mims, Leon haywood, Rev run, Lil jon, E 40, Dmc, Curtis lundy, Charles williams",
Akon,Don't Matter,14-Nov-06,R&;B,"Anthony lawson, Bob marley, R kelly, Akon",
Crime Mob,Rock Yo Hips,4-Dec-06,Rap,,Lil Scrappy
Green Day,Working Class Hero,11-Jun-07,Rock,John lennon,
Jack Johnson,Imagine,,Pop,,
Dashboard Confessional,Stolen,27-Jun-06,Pop,Chris carrabba,
Daddy Yankee,Impacto,5-Jun-07,"Rap,Puerto Rico,Remix,Latin Urban,Latin Music,En Espa\xc3\xb1ol,Reggaeton","Daddy yankee, William, Fergie",Fergie
The Smashing Pumpkins,Doomsday Clock,10-Jul-07,Rock,Billy corgan,
Ozzy Osbourne,I Don't Wanna Stop,22-May-07,"Metal,Rock","Zakk wylde, Kevin churko, Ozzy osbourne",
Diddy,Last Night,27-Feb-07,"Pop,R&;B,Rap","Shannon slam lawrence, Jack knight, Mario winans, Keyshia cole, Diddy",Keyshia Cole
Nickelback,If Everyone Cared,,Rock,Nickelback,
Carrie Underwood,Wasted,6-Feb-07,Country,"Hillary lindsey, Marv green, Troy verges",
Blake Lewis,You Give Love A Bad Name,,Pop,,
Alan Jackson,A Woman's Love,8-Jan-07,Country,Alan jackson,
Jordin Sparks,This Is My Now,24-May-07,Pop,"Scott krippayne, Jeff peabody",
Nelly Furtado,All Good Things,17-Nov-06,"Folk,Ballad,Pop","Danja, Timbaland, Chris martin, Nelly furtado",
Toby Keith,High Maintenance Woman,,"Country,Rock",,
Daughtry,It's Not Over,21-Nov-06,"Post-Grunge,Pop,Pop-Rock,Rock","Mark wilkerson, Gregg wattenberg, Ace young, Chris daughtry",
Tim McGraw,Last Dollar,8-Jan-07,"Country,Rock",Big kenny,
Nelly Furtado,Say It Right,30-Oct-06,R&;B,"Danja, Timbaland, Nelly furtado",
The Red Jumpsuit Apparatus,Face Down,18-Jul-06,Rock,Ronnie winter,
India.Arie,Beautiful Flower,,Pop,,
Young Jeezy,Go Getta,12-Dec-06,Rap,"Kevin cossom, Jeezy, R kelly, The runners",R. Kelly
Fall Out Boy,"This Ain't A Scene, It's An Arms Race",16-Jan-07,"Protest Songs,Electronic Rock,Alternative Pop,Alternative,Alternative Rock,Pop-Rock,Punk Rock,Pop-Punk,Emo,Rock","Patrick stump, Pete wentz",
The Smashing Pumpkins,Tarantula,10-Jul-07,Rock,Billy corgan,
50 Cent,Straight To The Bank,29-Jun-07,Rap,"50 cent, Dr dre, Ty fyffe",
Christina Aguilera,Candyman,20-Feb-07,Pop,"Christina aguilera, Linda perry",
Carrie Underwood,I'll Stand By You,24-Apr-07,"Country,Rock","Billy steinberg, Tom kelly, Chrissie hynde",
Blake Shelton,Don't Make Me,6-Nov-06,"Country,Rock","Dave berg, Deanna bryant, Marla cannon goodman",
Robin Thicke,Lost Without U,30-Jan-07,"R&;B,Pop","Sean hurley, Robin thicke",
The Fray,How To Save A Life,13-Sep-05,"Piano,Adult Contemporary,Adult Alternative,Pop-Rock,Alternative Rock,Pop,Rock","Joe king, Isaac slade",
Martina McBride,Anyway,3-Apr-07,Country,"Martina mcbride, Brett warren, Brad warren",
Katharine McPhee,Over It,30-Jan-07,Pop,"Josh alexander, Ruthanne, Billy steinberg",
Lily Allen,Smile,3-Jul-06,"Adult Alternative,Indie Pop,UK,Reggae,Pop","Iyiola babalola, Darren lewis, Lily allen",
Kenny Chesney,Beer In Mexico,8-Nov-05,"Country,Rock",Kenny chesney,
Linkin Park,Given Up,17-Feb-08,"Metalcore,Metal,Alternative Rock,Alternative Metal,Hard Rock,Rock","Dave farrell, Joe hahn, Rob bourdon, Brad delson, Mike shinoda, Chester bennington",
The Killers,Read My Mind,3-Feb-07,"Synth-Pop,Alternative Rock,Rock","Brandon flowers, Dave keuning, Mark stoermer",
Beyonce,Irreplaceable,23-Oct-06,"Pop,R&;B","Mikkel storleer eriksen, Espen lind, Amund bjorklund, Tor erik hermansen, Ne yo, Beyonce",
Unk,Walk It Out,30-Jan-07,"East Coast,Atlanta,Dirty South,Remix,Rap","Andre 3000, Big boi, Unk, Jim jones",
Hilary Duff,With Love,20-Feb-07,"Dance-Pop,Soundtrack,Electro,Pop","Vada nobles, Kara dioguardi, Hilary duff, Julius diaz",
Secondhand Serenade,Vulnerable,,Pop,,
Dierks Bentley,Long Trip Alone,17-Oct-06,"Country,Rock",,
Three 6 Mafia,Doe Boy Fresh,2-Jan-07,Rap,"Chamillionaire, Juicy j, Dj paul",Chamillionaire
Breaking Benjamin,Breath,8-Aug-06,"Hard Rock,Post-Grunge,Alternative Metal,Rock","Breaking benjamin, Benjamin burnley",
Snow Patrol,Signal Fire,,Pop,"Jonny quinn, Paul wilson, Tom simpson, Nathan connolly, Gary lightbody",
MIKA,Grace Kelly,8-Jan-07,"UK,Power Pop,Glam Rock,Pop,Rock","Dan warner, John merchant, Jodi marr, Mika",
Paul Wall,I'm Throwed,25-Mar-08,Rap,"Paul wall, Jermaine dupri",Jermaine Dupri
Lumidee,She's Like The Wind,3-Apr-07,"R&;B,Rap","Stacy widelitz, Patrick swayze",Tony Sunshine
Incubus,Dig,28-Nov-06,"Alternative Rock,Rock",Incubus,
John Mayer,Gravity,31-Jan-07,"Blues Rock,Rock",John mayer,
Joe,If I Was Your Man,13-Jul-07,R&;B,"Mikkel storleer eriksen, Tor erik hermansen, Phillip taj jackson",
Pretty Ricky,On The Hotline,,Rap,"Hurby azor, Pretty ricky, Static major",
The Fray,Look After You,13-Sep-05,"Pop-Rock,Alternative Rock,Pop,Rock","Joe king, Isaac slade",
Rich Boy,Throw Some D's,15-Aug-06,Rap,"Zone 4 inc, Drumma boy, Gregory williams, Polow da don, Rich boy",Polow Da Don
Swizz Beatz,It's Me Snitches,,Pop,,
The Pussycat Dolls,I Don't Need A Man,25-Sep-06,Pop,"Kara dioguardi, Nicole scherzinger, Rich harrison",
Beyonce,Upgrade U,4-Sep-06,"Rap,R&;B,Pop","Makeba riddick, Cameron wallace, Swizz beatz, Willie clarke, Solange, Sean garrett, Jay z, Clarence reid, Beyonce, Angela beyince",Jay Z
Josh Turner,Me And God,24-Jan-06,"Country,Rock",Josh turner,
Omarion,Ice Box,31-Oct-06,R&;B,"Patrick j que smith, Omarion, Keri hilson, Ezekiel lewis, Justin wright, Antonio dixon, Sierra thornton, Yasunori mitsuda",
Avril Lavigne,Keep Holding On,27-Nov-06,"Pop,Canada",Avril lavigne,
T.I.,Top Back,28-Mar-06,Rap,"Ti, Mannie fresh",
Blue October,Into The Ocean,4-Apr-06,"Alternative Rock,Rock",Justin furstenfeld,
Keith Urban,Stupid Boy,5-Dec-06,Country,"Sarah buxton, Deanna bryant, Dave berg",
Trace Adkins,Ladies Love Country Boys,15-Aug-06,Country,"Rivers rutherford, George teren, Jamey johnson",
Gary Allan,A Feelin' Like That,,Pop,,
Joe Nichols,I'll Wait For You,31-Jul-06,Country,"Harley allen, Bill anderson",
Young Buck,Get Buck,,Rap,Young buck,
Fat Joe,Make It Rain,12-Jun-07,"Remix,Rap","Fat joe, Dj khaled, R kelly, Danja, Lil wayne, Ti, Birdman, Rick ross",Lil Wayne
Akon,I Wanna Love You,14-Sep-06,"R&;B,Rap","Snoop dogg, Akon",Snoop Dogg
Akon,Smack That,26-Sep-06,"R&;B,Rap","Mike strange, Eminem, Luis resto, Akon",Eminem
John Mayer,Waiting On The World To Change,1-Aug-06,"Protest Songs,Singer-Songwriter,Adult Alternative,Adult Contemporary,Pop-Rock,Soul,Blues Rock,Rock",John mayer,
"Rihanna, Sean Paul",Break It Off,13-Nov-06,"Electro-Pop,Electronic,Dance-Pop,Dance,Jamaica,Dancehall,Pop","Don corleon, K ford, Sean paul, Rihanna",
Three Days Grace,Pain,13-Jun-06,"Alternative Rock,Rock","Brad walst, Neil sanderson, Gavin brown, Barry stock, Adam gontier",
Brandi Carlile,The Story,3-Apr-07,"Country,Rock",Phil hanseroth,
Bjork,Earth Intruders,1-May-07,"Experimental,Electronic,Pop","Danja, Timbaland, Bjork",
Jennifer Lopez,Que Hiciste,26-Jan-07,"Pop,Latin Pop,En Espa\xc3\xb1ol,R&;B","Julio reyes, Jimena romero, Marc anthony",
Good Charlotte,The River,4-Jan-07,Rock,"Benji madden, Joel madden",M. Shadows And Synyster Gates
Ashley Tisdale,Kiss The Girl,27-Mar-07,Rock,Howard ashman,
Jim Jones,We Fly High,21-Oct-06,"Producer,Rap",Max b,
Fabolous,Diamonds,3-Apr-07,Rap,"Hitmaka, Jeezy, Fabolous",Young Jeezy
Jonas Brothers,Year 3000,8-Aug-06,"Cover,Pop,Teen Pop,Pop-Rock","Nick jonas, Joe jonas, Kevin jonas, Steve robson, Charlie simpson, Matt willis, James bourne",
Vanessa Hudgens,Say OK,27-Mar-07,Pop,"Savan kotecha, Arnthor birgisson",
Timbaland,Release,4-Feb-07,Rap,"Timbaland, Justin timberlake, 6two",Justin Timberlake
Ludacris,Runaway Love,12-Feb-07,Rap,"Doug e fresh, Slick rick, Polow da don, Keri hilson, Ludacris",Mary J. Blige
Modest Mouse,Dashboard,16-Jan-07,"Indie Rock,Rock","Isaac brock, Modest mouse",
MIKA,Love Today,23-Apr-07,"UK,Power Pop,Pop,Rock",Mika,
The Game,Wouldn't Get Far,14-Nov-06,Rap,"The game, Kanye west, Marilyn mcleod, Pam sawyer",Kanye West
Jack Ingram,Lips Of An Angel,,Pop,,
Marques Houston,Circle,24-Jan-07,R&;B,"Wyldcard, Bryan michael cox, Marques houston, Tanya white, Adonis shropshire",
Fergie,Fergalicious,23-Oct-06,"Memes,Dance-Pop,Dance,Electro-Pop,Electronic,Hip-Hop,Pop,Rap","Crazy j, Baby d jj fad, Og rocker, Mc jb, Arabian prince, Fergie, Derrick rahming, William",
Snow Patrol,Chasing Cars,6-Jun-06,Rock,"Jonny quinn, Paul wilson, Tom simpson, Nathan connolly, Gary lightbody",
Hellogoodbye,Here,14-May-06,Rock,Forrest kline,
Justin Timberlake,My Love,8-Sep-06,"Rap,Electro-Pop,R&;B,Pop","Ti, Timbaland, Justin timberlake, Danja",T.I.
Ciara,Promise,5-Dec-06,R&;B,"Blac elvis, Polow da don, Jasper cameron, Ciara",
Joss Stone,Tell Me 'Bout It,5-Mar-07,"Soul,R&;B,Pop","Joss stone, Raphael saadiq, Bobby ozuna",
Regina Spektor,Fidelity,13-Jun-06,"Pop,Rock",Regina spektor,
The Fratellis,Flathead,4-Mar-07,"Adult Alternative,Alternative Rock,Indie Rock,UK,Post-Punk,Rock",The fratellis,
Jibbs,King Kong,,Rap,Jibbs,Chamillionaire
"Brooks, Dunn",Hillbilly Deluxe,6-Nov-06,Country,"Craig wiseman, Brad crisler",
Jennifer Hudson,And I Am Telling You I'm Not Going,27-Sep-08,R&;B,"Tom eyen, Henry krieger",
Yung Joc,1st Time,,Rap,,"Marques Houston, Trey Songz"
My Chemical Romance,Famous Last Words,22-Jan-07,"Hard Rock,Rock,Emo,Alternative Rock","Ray toro, Frank iero, Mikey way, Gerard way, Bob bryar",
Augustana,Boston,,"Pop-Rock,Rock","Josiah rosen, Justin south, Jared palomer, Dan layus",
Rodney Atkins,Watching You,,Country,,
Nine Inch Nails,Survivalism,17-Apr-07,"Industrial,Rock",Trent reznor,
Thirty Seconds To Mars,From Yesterday,30-Aug-05,"Alternative Rock,Rock","Matt wachter, Tomo milicevic, Shannon leto, Jared leto",
Jason Michael Carroll,Alyssa Lies,17-Oct-06,Pop,Jason michael carroll,
Dixie Chicks,Not Ready To Make Nice,24-Mar-06,"Country,Rock","Dan wilson, Emily robison, Natalie maines, Martie maguire",
My Chemical Romance,Welcome To The Black Parade,12-Sep-06,"Punk Rock,Hard Rock,Post-Hardcore,Emo,Alternative Rock,Pop-Punk,Rock","Mikey way, Gerard way, Ray toro, Frank iero, Bob bryar",
Justin Timberlake,SexyBack,18-Jul-06,"Electro-Pop,R&;B,Pop","Danja, Timbaland, Justin timberlake",
Timbaland,Give It To Me,6-Feb-07,"Beef,Portugal,Canada,West Coast,Dance-Pop,Dance,R&;B,Electro-Pop,Electro,Pop,Rap","Attitude, Timbaland, Danja, Nelly furtado, Justin timberlake","Nelly Furtado, Justin Timberlake"
Mat Kearney,Nothing Left To Lose,,Pop,Mat kearney,
George Strait,It Just Comes Natural,9-Oct-06,"Country,Rock","Marvin green, Jim collins",
Beyonce,Listen,5-Dec-06,"R&;B,Pop","Beyonce, Anne preven, Scott cutler, Henry krieger",
Craig Morgan,Little Bit Of Life,14-Aug-06,Country,"Tony mullins, Danny wells",
The Pussycat Dolls,Wait A Minute,16-Oct-06,"Pop,Dance","Six2, Keri hilson, Timbaland",Timbaland
Paula DeAnda,Walk Away,,"R&;B,Pop","Steve kipner, Elan luz riviera, Dan hill, Emilio cancio bello, Stargate, Ne yo, Christina milian",The DEY
The All,It Ends Tonight,19-Sep-06,"Alternative Rock,Rock","Tyson ritter, Nick wheeler",
Diddy,Tell Me,17-Oct-06,Rap,"Diddy, Just blaze, Shannon slam lawrence, Royce da 59, Jack knight, Shannon jones, Static major, Yummy bingham, Leroy watson",Christina Aguilera
Elliott Yamin,Movin' On,,Pop,,
Dixie Chicks,The Neighbor,,Pop,,
Korn,Freak On A Leash,,Pop,,Amy Lee
Snoop Dogg,That's That,10-Oct-06,"R&;B,West Coast,Rap","Snoop dogg, Nottz, R kelly, The doc, Stat quo",R. Kelly
Gwen Stefani,Wind It Up,31-Oct-06,"Electro-Pop,Pop","Gwen stefani, Pharrell williams, Oscar hammerstein ii, Richard rodgers",
Hinder,Lips Of An Angel,24-Jul-06,"Alternative Rock,Rock","Cody hanson, Austin winkler, Brian howes",
Bow Wow,Shortie Like Mine,23-Oct-06,"R&;B,Rap","Da brat, Jermaine dupri, Bryan michael cox, Johnta austin","Chris Brown, Johnta Austin"
KT Tunstall,Suddenly I See,29-Aug-05,"Pop,Pop-Rock",Kt tunstall,
Paul Wall,Break 'Em Off,3-Apr-07,Rap,"Paul wall, Lil keke",Lil' KeKe
Jason Aldean,Amarillo Sky,26-Jun-06,Country,"Bart pursley, Rodney clawson, John rich, Big kenny",
AnnaSophia Robb,Keep Your Mind Wide Open,,Pop,,
Corinne Bailey Rae,Like A Star,7-Nov-05,"Pop,R&;B",Corinne bailey rae,
Young Jeezy,I Luv It,2-Nov-06,Rap,"Jeezy, Dj toomp",
Brad Paisley,She's Everything,28-Aug-06,"Country,Rock","Brad paisley, Wil nance",
Jordan Pruitt,Outside Looking In,6-Jun-06,"Teen Pop,Pop","Keith thomas, Robin scoffield, Jordan pruitt",
John Legend,Save Room,8-Aug-06,"Soul,R&;B","James b cobb jr, John legend, William, Jessy wilson, Buddy buie",
Corbin Bleu,Push It To The Limit,25-Nov-06,"Disney,Soundtrack,Pop","Robbie nevil, Matthew gerrard",
Lil' Boosie,Zoom,24-Oct-06,Rap,"Yung joc, Boosie badazz",Yung Joc
Nickelback,Far Away,13-Feb-06,"Ballad,Adult Contemporary,Pop-Rock,Alternative Rock,Post-Grunge,Rock","Ryan peake, Mike kroeger, Chad kroeger, Daniel adair",
Christina Aguilera,Hurt,19-Sep-06,"Ballad,Pop","Christina aguilera, Mark ronson, Linda perry",
Sheryl Crow,Not Fade Away,,Pop,,
Ashley Tisdale,Be Good To Me,26-Dec-06,"Disney,Soundtrack,R&;B,Dance-Pop,Pop","Niclas molinder, Joacim persson, Kara dioguardi",
Kellie Pickler,Red High Heels,13-Sep-06,"Country,Rock","Karen rochelle, Aimee mayo, Chris lindsey, Kellie pickler",
Rob Thomas,Streetcorner Symphony,,Pop,,
Norah Jones,Thinking About You,30-Jan-07,"Soul Jazz,Ballad,Jazz Fusion,Adult Alternative,Adult Contemporary,Rock,Blues,Folk,Jazz","Norah jones, Ihran ersahin",
The Naked Brothers Band,Crazy Car,,Pop,,
Sugarland,Want To,7-Nov-06,"Country,Rock",,
Trent Tomlinson,One Wing In The Fire,20-May-06,Pop,"Trent tomlinson, Bobby pinson",
Jordan Pruitt,Jump To The Rhythm,17-Dec-06,"Disney,Soundtrack,Teen Pop,Pop","Robyn johnson, Frank fitzpatrick",
Stone Sour,Through Glass,22-Jul-06,Rock,Stone sour,
Ludacris,Money Maker,17-Jul-06,Rap,"Ludacris, Pharrell williams",Pharrell
Lil Scrappy,Money In The Bank,,Rap,"Isaac hayes iii, Young buck, Lil scrappy",Young Buck
Nelly Furtado,Maneater,6-May-06,"Electro-Pop,New Wave,Electronic Rock,Dance-Pop,Pop","Nelly furtado, Jim beanz, Danja, Timbaland",
Tim McGraw,My Little Girl,7-Aug-06,"Country,Rock","Tom douglas, Tim mcgraw",
The Shins,Phantom Limb,23-Jan-07,Rock,James mercer,
The Wreckers,"My, Oh My",,Country,"Wayne kirkpatrick, Michelle branch, Josh leo, Jessica harp",
Petey Pablo,Show Me The Money,8-Aug-06,Rap,"Ron neff u feemster, Petey pablo",
Mary J. Blige,Take Me As I Am,17-Aug-06,"Soul,R&;B","Mary j blige, Ron fair, Keri hilson, Candice nelson, Lonnie liston smith, Ezekiel lewis, Thabiso tab nkhereanye",
Molly,Anna,28-Nov-06,Rock,Incubus,
Jay,Lost One,21-Nov-06,Rap,"Mel and tim, Jay z, Dr dre, Mark batson",
Cartel,Honestly,1-Apr-06,"Pop-Punk,Rock",Will pugh,
Taylor Swift,Tim McGraw,19-Jun-06,"Pop Country,Country,Pop","Liz rose, Taylor swift",
Rascal Flatts,What Hurts The Most,21-Oct-03,"Disney,Soundtrack,Country,Rock","Steve robson, Jeffrey steele",
Rascal Flatts,My Wish,,"Country,Rock","Steve robson, Jeffrey steele",
Hannah Montana,If We Were A Movie,24-Oct-06,"Disney,Soundtrack,Pop","Holly mathis, Jeannie lurie",
Vanessa Hudgens,Come Back To Me,12-Sep-06,Pop,"Peter beckett, Rock mafia, Jc crowley",
Cherish,Unappreciated,,Pop,"Cherish, Jazze pha, Ced keyz",
"U2, Green Day",The Saints Are Coming,31-Oct-06,"Cover,Ireland,Alternative Rock,Rock","Stuart adamson, Richard jobson",
Chris Brown,Say Goodbye,8-Aug-06,"DMV,R&;B","Wyldcard, Adonis, Bryan michael cox",
JoJo,Too Little Too Late,24-Jul-06,"Pop,R&;B,Rap","Ruthanne, Josh alexander, Billy steinberg",
Evanescence,Call Me When You're Sober,13-Sep-06,Rock,"Terry balsamo, Amy lee",
OK Go,Here It Goes Again,1-Jan-06,"Pop-Punk,Power Pop,Pop-Rock,Indie Rock,Rock",Damian kulash,
"Birdman, Lil Wayne",Stuntin' Like My Daddy,18-Jul-06,"Trap,Rap","Lil wayne, Birdman",
Diddy,Come To Me,12-Sep-06,"R&;B,Rap","Diddy, Mista raja, Yakubu izuagbe, Younglord, Shannon slam lawrence, Mike winans, Shay winans, Jacoby white, Nicole scherzinger",Nicole Scherzinger
"Eminem, 50 Cent, Lloyd Banks, Ca$his",You Don't Know,7-Nov-06,"Hip-Hop,Electronic,SHADYXV,Rap","Ca his, Luis resto, Lloyd banks, 50 cent, Eminem",
JAY,Show Me What You Got,6-Oct-06,"East Coast,Jazz Rap,Rap","Just blaze, Jay z, E sadler",
AFI,Love Like Winter,26-Sep-06,Rock,"Davey havok, Jade puget, Hunter burgan, Adam carson",
Mike Jones,Mr. Jones,4-Sep-06,Rap,"Mike jones, Myke diesel",
Pitbull,Ay Chico,31-Oct-06,Rap,,
Kenny Chesney,You Save Me,8-Nov-05,"Country,Rock","Troy verges, Brett james",
Nas,Hip Hop Is Dead,5-Nov-06,Rap,"William, Doug ingle, Jerry lordan, Nas",will.i.am
Montgomery Gentry,Some People Change,,Country,,
Lady Sovereign,Love Me Or Hate Me,17-Oct-06,Rap,"Dr luke, Louise harman",
Red Hot Chili Peppers,Tell Me Baby,17-Jul-06,"Pop-Rock,Adult Alternative,Alternative Rock,Funk Rock,Rock","Anthony kiedis, Chad smith, John frusciante, Flea",
Danity Kane,Show Stopper,22-Aug-06,Rap,,
Beyonce,Ring The Alarm,10-Sep-06,"R&;B,Pop","Sean garrett, Swizz beatz, Beyonce",
Chingy,Dem Jeans,19-Sep-06,Rap,"Jermaine dupri, Chingy",Jermaine Dupri
Hannah Montana,Who Said,24-Oct-06,"Disney,Soundtrack,Pop","Jay landers, Robbie nevil, Matthew gerrard",
"Webstar, Young B",Chicken Noodle Soup.,22-Aug-06,"Rap,Pop",Bianca bonnie,The Voice Of Harlem
Hannah Montana,Best Of Both Worlds,18-Mar-06,"Disney,Soundtrack,Pop","Robbie nevil, Matthew gerrard",
Plain White T's,Hate,,Pop,,
The Killers,When You Were Young,18-Sep-06,"Alternative Rock,Rock","Mark stoermer, Ronnie vannucci jr, Dave keuning, Brandon flowers",
Sarah McLachlan,River,17-Oct-06,Pop,,
The Killers,A Great Big Sled,5-Dec-06,Rock,The killers,Toni Halliday
The Fray,Happy Xmas,12-Dec-06,Pop,"Yoko ono, John lennon",
Heartland,I Loved Her First,5-Jun-06,Country,,
RBD,Tu Amor,1-Jan-07,Rock,,
Fall Out Boy,The Carpal Tunnel Of Love,12-Dec-06,"Alternative Pop,Alternative,Pop-Rock,Punk Rock,Alternative Rock,Emo,Pop-Punk,Rock","Wesley eisold, Patrick stump, Pete wentz",
Jibbs,Chain Hang Low,24-Oct-06,Rap,,
The Game,Let's Ride,25-Sep-06,Rap,"The game, Scott storch",
Josh Groban,I'll Be Home For Christmas,,Pop,Kim gannon,
Ciara,Get Up,25-Jul-06,"Soundtrack,Pop,Dance,Electro-Pop,R&;B,Rap","Ciara, Chamillionaire, Jazze pha",Chamillionaire
Fergie,London Bridge,18-Jul-06,"Hip-Hop,Rap,Dance-Pop,Pop","Polow da don, Mike hartnett, Fergie, Sean garrett",
Lonestar,Mountains,17-Oct-06,Country,,
Breaking Benjamin,The Diary Of Jane,25-Jul-06,"Nu-Metal,Hard Rock,Post-Grunge,Alternative Rock,Alternative Metal,Rock","Mark james klepaski, Aaron fink, Benjamin burnley",
George Strait,Give It Away,,"Country,Rock","Jamey johnson, Buddy cannon, Bill anderson",
The Pussycat Dolls,Buttons,6-Jul-06,Rap,"Snoop dogg, Nicole scherzinger, Jason perry, Polow da don, Sean garrett",Snoop Dogg
Mario Vazquez,Gallery,26-Sep-06,Rap,Ne yo,
Brooke Hogan,About Us,13-Jun-06,Rap,"Scott storch, Paul wall, Poo bear",Paul Wall
RBD,Ser O Parecer,18-Sep-06,"En Espa\xc3\xb1ol,Pop",Armando avila,
Ying Yang Twins,Dangerous,,Rap,,Wyclef
Rick Ross,Push It,17-May-06,Rap,"Giorgio moroder, Pete bellotte, Jr rotem, Rick ross",
Keith Urban,Once In A Lifetime,22-Aug-06,Country,"Keith urban, John shanks",
Thirty Seconds To Mars,The Kill,30-Aug-05,"Alternative,Alternative Rock,Rock",Jared leto,
Lyfe Jennings,S.E.X.,1-Aug-06,Rap,Lyfe jennings,
Lionel Richie,I Call It Love,12-Sep-06,Rock,,
Chris Cornell,You Know My Name,1-Jan-06,Rock,"David arnold, Chris cornell",
The Fray,Over My Head,13-Sep-05,"Adult Alternative,Adult Contemporary,Pop-Rock,Alternative Rock,Pop,Rock","Joe king, Isaac slade",
Shareefa,Need A Boss,25-Jul-06,"R&;B,Rap","Ludacris, Delisha thomas, Rodney jerkins, Hugo peretti, Lashawn daniels, Luigi creatore, Anesha birchett, George david weiss",Ludacris
Dierks Bentley,Every Mile A Memory,17-Oct-06,"Rock,Country","Dierks bentley, Brett beavers, Steve bogard",
The Game,It's Okay,24-Jul-06,Rap,"The game, D roc, Junior reid, Reefa",Junior Reid
"Aly, AJ",Greatest Time Of Year,21-Nov-06,"Christmas,Pop","Tim james, Antonina armato, Aj michalka, Aly michalka",
JAY,Kingdom Come,21-Nov-06,Rap,"L parker, A miller, Just blaze, Jay z",
Gnarls Barkley,Crazy,4-Apr-06,"Alternative Pop,Alternative R&;B,Adult Alternative,Alternative Rock,Adult Contemporary,Electronic,Neo Soul,Soul,Soul Pop,Pop,R&;B,Rock","Gian piero reverberi, Gian franco reverberi, Danger mouse, Ceelo green",
Jack Ingram,Love You,1-Jun-06,Rock,,
Monica,Everytime Tha Beat Drop,24-Jul-06,"R&;B,Rap","Pimpin, Parlae dem franchize boyz, Jermaine dupri, James phillips, Johnta austin, Gerald tiller, Bernard leverette, Dangelo hunt, Charles hammond, Robert hill",Dem Franchize Boyz
Five For Fighting,The Riddle,,Rock,,
Panic! At The Disco,I Write Sins Not Tragedies,27-Feb-06,"Punk Rock,Emo,Alternative Pop,Alternative,Alternative Rock,Pop-Rock,Pop-Punk,Rock","Ryan ross, Spencer smith, Brendon urie",
Josh Turner,Would You Go With Me,24-Jan-06,"Country,Rock",,
Yung Joc,I Know You See It,,Rap,,Brandy 'Ms. B.' Hambrick
Bowling For Soup,High School Never Ends,19-Sep-06,Rock,"Adam schlesinger, Jaret reddick",
Alejandro Sanz,A La Primera Persona,,"En Espa\xc3\xb1ol,Rock",,
Ne,Sexy Love,26-Jun-06,"R&;B,Rap","Mikkel storleer eriksen, Tor erik hermansen, Ne yo",
Corinne Bailey Rae,Put Your Records On,20-Feb-06,"Adult Alternative,Adult Contemporary,Soul Pop,Neo Soul,Pop,R&;B","Steve chrisanthou, John beck, Corinne bailey rae",
Ruben Studdard,Change Me,,Pop,Tank,
Jesse McCartney,Right Where You Want Me,26-Aug-06,Pop,"Adam watts, Jesse mccartney, Dory lobel, Andy dodd",
Toby Keith,Crash Here Tonight,,"Country,Rock",,
Toby Love,Tengo Un Amor,,Rap,,"Rakim, Ken"
Chingy,Pullin' Me Back,21-Jul-06,Rap,"Jaco pastorius, Brian alexander morgan, Howard bailey, James phillips, Jermaine dupri",Tyrese
Nelly Furtado,Promiscuous,25-Apr-06,"Dance-Pop,Synth-Pop,R&;B,Canada,Pop,Rap","Danja, Timbaland, Attitude, Nelly furtado",Timbaland
