Artists,Name,Date,Genre,Writing.Credits,Features
"Lil Nas,",Old Town Road,5-Apr-19,"Country,Atlanta,Alternative Country,Hip-Hop,Trap,Memes,Remix,Country Rap,Rap","Jozzy, Atticus ross, Trent reznor, Billy ray cyrus, Lil nas x",Billy Ray Cyrus
"Shawn Mendes, Camila Cabello",Senorita,21-Jun-19,Pop,"Cashmere cat, Jack patterson, Charli xcx, Benny blanco, Watt, Ali tamposi, Camila cabello, Shawn mendes",
Billie Eilish,Bad Guy,29-Mar-19,"Hip-Hop,Dark Pop,House,Trap,Memes,Alternative Dance,Alternative,Alternative Pop,Dance-Pop,Dance,Electro-Pop,Electro,Pop","Billie eilish, Finneas",
Khalid,Talk,7-Feb-19,"Synth-Pop,Pop","Howard lawrence, Guy lawrence, Khalid",
"Ed Sheeran, Justin Bieber",I Don't Care,10-May-19,"Canada,UK,Dance,Dance-Pop,Pop","Ed sheeran, Justin bieber, Shellback, Max martin, Poo bear, Fred gibson",
Jonas Brothers,Sucker,1-Mar-19,"Alternative Pop,Boy Band,Teen Pop,Pop-Rock,Pop","Ryan tedder, Louis bell, Frank dukes, Nick jonas, Joe jonas, Kevin jonas",
DaBaby,Suge,1-Mar-19,"Trap,East Coast,Rap","Jetsonmade, Pooh beatz, Dababy",
Drake,Money In The Grave,15-Jun-19,"Hip-Hop,Rap,Basketball,NBA,Canada","Asoteric, Ljay currie, Cydney christine, Rick ross, Drake",Rick Ross
Chris Brown,No Guidance,8-Jun-19,"Alternative R&;B,Hip-Hop,Rap,Pop,DMV,Canada,R&;B","Velous, J louis, Vinylz, Michee patrick lebrun, Teddy walton, Nija, Drake, Chris brown",Drake
Post Malone,Wow.,24-Dec-18,"Memes,Hip-Hop,Trap,Rap","Frank dukes, Billy walsh, Louis bell, Post malone",
Lizzo,Truth Hurts,19-Sep-17,"Pop,Rap","Ricky reed, Jesse saint john, Steven cheung, Lizzo",
"Post Malone, Swae Lee",Sunflower,18-Oct-18,"Rap,Disney,Hip-Hop,Marvel,Soundtrack,R&;B,Pop","Carl rosen, Louis bell, Billy walsh, Carter lang, Swae lee, Post malone",
Taylor Swift,You Need To Calm Down,14-Jun-19,"Synth-Pop,LGBTQ+,Pop","Joel little, Taylor swift",
Shawn Mendes,If I Can't Have You,3-May-19,"Canada,Teen Pop,Pop","Dmitry fedorov, Teddy geiger, Shawn mendes, Scott harris, Nate mercereau",
"Sam Smith, Normani",Dancing With A Stranger,11-Jan-19,"UK,Pop","Tor erik hermansen, Mikkel storleer eriksen, Jimmy napes, Normani, Sam smith",
Lil Nas X,Panini,20-Jun-19,"Memes,Atlanta,Hip-Hop,Trap,Rap","Dot da genius, Kurt cobain, David biral, Denzel baptiste, Lil nas x",
Halsey,Without Me,4-Oct-18,"Synth-Pop,R&;B,Alternative Pop,Ballad,Pop,Alternative","Justin timberlake, Timbaland, Halsey, Delacey, Louis bell, Amy allen, Scott storch",
Blake Shelton,God's Country,29-Mar-19,Country,"Jordan schmidt, Hardy, Devin dawson",
Polo G,Pop Out,13-Jan-19,"Trap,Rap","Lil tjay, Polo g",Lil Tjay
Nicki Minaj,MEGATRON,21-Jun-19,"East Coast,Hip-Hop,Rap","Haldane brown, Andrew pop wansel, Brittany coney, Blu june, Nicki minaj",
Ava Max,Sweet But Psycho,17-Aug-18,"Dance-Pop,Dance,Electronic Pop,Electro,R&;B,Electronic,Electro-Pop,UK,Pop","Ava max, Tix, Cirkut, Madison love, Cook classics",
"Lil Nas X, Cardi B",Rodeo,21-Jun-19,"Country,Atlanta,East Coast,Trap,Country Rap,Hip-Hop,Rap","Denzel baptiste, Russ chell, Roy lenzo, Cardi b, David biral, Lil nas x",
Ariana Grande,7 Rings,18-Jan-19,"Memes,Trap,R&;B,Pop","Ariana grande, Richard rodgers, Tbhits, Njomza, Michael mikey foster, Kaydence, Tayla parx, Scootie, Oscar hammerstein ii, Victoria monet",
Panic! At The Disco,"Hey Look Ma, I Made It",22-Jun-18,"Pop-Rock,Jazz Fusion,Alternative,Alternative Pop,Electro-Pop,Pop","Jake sinclair, Michael angelakos, Dillon francis, Sam holland, Morgan kibby, Brendon urie",
"Marshmello, Bastille",Happier,17-Aug-18,"Adult Alternative,Producer,Alternative Dance,Alternative Pop,Alternative Rock,Adult Contemporary,Electro-Pop,Future Bass,Electronic,Dance,Pop","Steve mac, Marshmello, Dan smith",
Lee Brice,Rumor,3-Nov-17,Country,"Kyle jacobs, Ashley gorley, Lee brice",
Katy Perry,Never Really Over,31-May-19,"Electro-Pop,Synth-Pop,Pop","Hayley warner, Katy perry, Dagny, Michelle buzz, Jason gill, Farrago, Zedd, Leah haywood, Daniel james",
Morgan Wallen,Whiskey Glasses,27-Apr-18,Country,"Kevin kadish, Ben burgess",
Blanco Brown,The Git Up,2-May-19,"Atlanta,Dance,Rap,Country Rap,Country",Blanco brown,
"Young Thug, J. Cole, Travis Scott",The London,23-May-19,"Hip-Hop,East Coast,Atlanta,Rap","T minus, Travis scott, J cole, Young thug",
Taylor Swift,ME!,26-Apr-19,"Dream-Pop,Bubblegum Pop,Dance-Pop,Pop","Brendon urie, Joel little, Taylor swift",Brendon Urie
Panic! At The Disco,High Hopes,23-May-18,"Adult Alternative,Rock,Power Pop,Pop-Rock,Alternative,Alternative Rock,Classical Crossover,Electro-Pop,Alternative Pop,Pop","Sam hollander, Cook classics, Tayla parx, Jake sinclair, Lolo, Ilsey, Jonas jeberg, Jenny owen youngs, Brendon urie",
Luke Combs,Beer Never Broke My Heart,8-May-19,"Rock,Country","Randy montana, Jonathan singleton, Luke combs",
City Girls,Act Up,16-Nov-18,"Motown,East Coast,Rap","Jt, Earlonthebeat, Lil yachty",
"benny blanco, Halsey, Khalid",Eastside,12-Jul-18,"R&;B,Pop","Happy perez, Benny blanco, Khalid, Halsey, Ed sheeran",
J. Cole,Middle Child,23-Jan-19,"Trap,East Coast,Rap",J cole,
"Daddy Yankee, Katy Perry",Con Calma,19-Apr-19,"Latin Pop,Dancehall,Pop,Reggaeton,En Espa\xc3\xb1ol,Latin Urban,Latin Music","Katy perry, Snow, Daddy yankee, Gaby music",Snow
"Mustard, Migos",Pure Water,16-Jan-19,"Atlanta,Trap,West Coast,Motown,Rap","Gylttryp, Mustard, Takeoff, Offset, Quavo",
Ed Sheeran,Cross Me,24-May-19,"Rap,R&;B,UK,Pop","Ed sheeran, Chance the rapper, Pnb rock, Fred gibson","Chance The Rapper, PnB Rock"
Meek Mill,Going Bad,30-Nov-18,"East Coast,Canada,Rap","Westen weiss, Wheezy, Drake, Meek mill",Drake
Khalid,Better,14-Sep-18,"Electro-Pop,Pop,R&;B","Tor erik hermansen, Mikkel storleer eriksen, Khalid, Charlie handsome, Digi, Denis kosiak",
"Lady Gaga, Bradley Cooper",Shallow,27-Sep-18,"Pop Country,Folk,Musicals,Screen,Pop-Rock,Soundtrack,Pop","Andrew wyatt, Anthony rossomando, Mark ronson, Lady gaga",
Cardi B,Press,31-May-19,"Hardcore Hip-Hop,Trap,Hip-Hop,Rap","Lewdini, Cardi b",
Dan + Shay,Speechless,18-May-18,Country,"Shay mooney, Jordan reynolds, Laura veltz, Dan smyers",
Travis Scott,Sicko Mode,3-Aug-18,"Hip-Hop,Memes,Rap,Canada,Trap","Mdbeats, Q tip, Travis scott, Tim gomringer, Swae lee, Sonny seeza, Richard finch, Mike dean, Luke, James jackson, Harry wayne casey, Easy mo bee, Drake, Chyskillz, Chylow parker, Brian higgins, Big hawk, Cubeatz, Hit boy, Oz, Roget chahayed, Tay keith",
"Tyler, The Creator",Earfquake,17-May-19,"Hip-Hop,Atlanta,Alternative R&;B,Experimental,Neo Soul,R&;B,Rap,Neo-Psychedelia,Alternative,Psychedelic","Playboi carti, Tyler the creator",
A Boogie Wit da Hoodie,Look Back At It,7-Dec-18,"Pop,Rap","Chrishan, Hitmaka, Jahaan sweet, A boogie wit da hoodie",
NLE Choppa,Shotta Flow,17-Jan-19,Rap,Nle choppa,
Ariana Grande,"Break Up With Your Girlfriend, I'm Bored",8-Feb-19,"Trap,Trip-Hop,Lo-Fi,R&;B,Pop","Kandi, Kevin shekspere briggs, Max martin, Ilya, Savan kotecha, Ariana grande",
Halsey,Nightmare,17-May-19,"Alternative Rock,Alternative Pop,Alternative,Pop-Punk,Pop","Trevor horn, Sergio galoyan, Martin kierszenbaum, Elena kiper, Benny blanco, Cashmere cat, Happy perez, Halsey",
"YG, Tyga, Jon Z",Go Loko,3-May-19,"Trap,Puerto Rico,West Coast,Rap","Mustard, Jon z, Tyga, Yg",
Lewis Capaldi,Someone You Loved,8-Nov-18,"UK,Pop","Tom barnes, Pete kelleher, Ben kohn, Rmans, Lewis capaldi",
Thomas Rhett,Look What God Gave Her,1-Mar-19,Country,"Thomas rhett, Rhett akins, Julian bunetta, John ryan, Jacob kasher, Ammar malik",
Jonas Brothers,Cool,5-Apr-19,"Teen Pop,Pop-Rock,Pop","Ryan tedder, Casey smith, Zach skelton, Nick jonas, Joe jonas, Kevin jonas",
Offset,Clout,22-Feb-19,"East Coast,Motown,Rap","Tim gomringer, Kevin gomringer, Offset",Cardi B
"Marshmello, Kane Brown",One Thing Right,21-Jun-19,Pop,"Josh hoge, Jesse frasure, Matt mcginn, Marshmello, Kane brown",
Kane Brown,Good As You,19-Oct-18,Country,"Will weatherly, Taylor phillips, Shy carter, Brock berryhill",
YK Osiris,Worth It,8-Feb-19,"Rap,East Coast,R&;B","Kiwi, Travis mills, Kim candilora jr, Taz taylor, Orlando woods jr, Melvin goggins jr, Yk osiris",
DJ Khaled,Just Us,16-May-19,"Rap,R&;B","Mr dj, Big boi, Dj khaled, Andre 3000, Blu june, Brittany coney, Sza",SZA
Luke Bryan,Knockin' Boots,29-Mar-19,Country,"Jon nite, Gordie sampson, Hillary lindsey",
P!nk,Walk Me Home,20-Feb-19,Pop,"P nk, Scott harris, Nate ruess",
Maren Morris,GIRL,17-Jan-19,"Pop,Country,Pop Country","Maren morris, Sarah aarons, Greg kurstin",
5 Seconds Of Summer,Easier,23-May-19,"Australia,Pop","Watt, Ali tamposi, Louis bell, Charlie puth, Michael clifford, Calum hood, Luke hemmings, Ashton irwin, Ryan tedder",
"Cardi B, Bruno Mars",Please Me,15-Feb-19,"Rap,East Coast,West Coast,Soul Pop,R&;B,Pop","Cardi b, Bruno mars, James fauntleroy, Jeremy reeves, Jonathan yip, Ray charles mccullough ii, Ray romulus",
Eric Church,Some Of It,5-Oct-18,Country,"Eric church, Clint daniels, Jeff hyde, Bobby pinson",
Dan + Shay,All To Myself,3-May-18,Country,"Shay mooney, Nicolle galyon, Jordan reynolds, Dan smyers",
"Bad Bunny, Tainy",Callaita,31-May-19,"Pop,Latin Pop,Dancehall,Reggaeton,Latin Music,Latin Urban,Puerto Rico,En Espa\xc3\xb1ol",Bad bunny,
Meek Mill,24/7,30-Nov-18,"East Coast,UK,R&;B,Rap","Robert waller, Beyonce, Scott storch, Nija, Pro logic, Oz, Ey, Austin powerz, Ella mai, Meek mill",Ella Mai
Ali Gatie,It's You,14-Jun-19,R&;B,Ali gatie,
Jason Aldean,Rearview Town,16-Mar-18,Country,"Neil thrasher, Bobby pinson, Kelley lovelace",
Lil Baby,Out The Mud,21-Jun-19,"Atlanta,Trap,Rap","Lil baby, Future",Future
"The Chainsmokers, Bebe Rexha",Call You Mine,31-May-19,"Electronic Pop,EDM,Electro House,Electro,Electro-Pop,Electronic,Dance-Pop,Dance,Pop","Alex pall, Tony ann, Andrew taggart, Watt, Ali tamposi, Steve mac, Norman whitfield",
"Summer Walker, Drake",Girls Need Love,27-Feb-19,"Atlanta,Canada,Remix,R&;B","Arsenio archer, Drake, Summer walker",
"Lunay, Daddy Yankee, Bad Bunny",Soltera,10-May-19,"Reggaeton,Latin Music,Latin Urban,Puerto Rico,Latin Pop,En Espa\xc3\xb1ol,Pop","Georg the mustache, Lunay, Daddy yankee, Bad bunny",
Florida Georgia Line,Talk You Out Of It,6-Jul-18,Country,"Hardy, Jameson rodgers, Hunter phelps, Alysa vanderheym",
SHAED,Trampoline,18-May-18,Pop,"Alex mendoza, Shaed",
"Yella Beezy, Gucci Mane, Quavo",Bacc At It Again,15-Mar-19,"Hip-Hop,Rap","Quay global, Darius roberts, Gucci mane, Quavo, Yella beezy",
Beyonce,Before I Let Go,17-Apr-19,"Bounce,Cover,Soundtrack,Pop,Soul Pop,Soul,Funk,R&;B","Beyonce, Jerome temple, Larry blackmon, Tomi jenkins, Frankie beverly",
DJ Khaled,Wish Wish,17-May-19,"Atlanta,Trap,Rap","Tay keith, Pardison fontaine, 21 savage, Cardi b, Dj khaled","Cardi B, 21 Savage"
Chris Young,Raised On Country,4-Jan-19,Country,"Corey crowder, Cary barlowe, Chris young",
Travis Scott,Wake Up,3-Aug-18,"Trap,R&;B,Canada,Rap","Adam feeney music, Nima jahanbin, Paimon jahanbin, Rupert thomas, Frank dukes, Mike dean, The weeknd, Travis scott",
Sech,Otro Trago,19-Apr-19,"Dancehall,Reggaeton,Latin Music,Latin Urban,En Espa\xc3\xb1ol,Puerto Rico,Latin Pop,Pop","Sech, Darell",Darell
Chase Rice,Eyes On You,13-Oct-17,Country,"Chase rice, Ashley gorley, Chris destefano",
Bryce Vine,La La Land,1-Mar-19,"Pop,Rap,Hip-Hop,R&;B","Sidney swift, Ryan baharloo, Michael onufrak, Desmond barnes, Alexander goodwin, Simon says, Sir nolan, Yg, J p clark, Bryce vine",YG
Billie Eilish,Ocean Eyes,19-Nov-15,"Alternative Dance,Synth-Pop,Ambient,Indie Pop,Alternative Pop,Alternative,Pop","Billie eilish, Finneas",
Marshmello,Here With Me,8-Mar-19,"Progressive House,House,Electro House,Electronic Pop,Alternative Pop,Electronic,Dubstep,Dance,Electro,Electronica,Electro-Pop,EDM,Synth-Pop,Pop","Steve mac, Martin doherty, Marshmello, Lauren mayberry, Iain cook",CHVRCHES
Brett Eldredge,Love Someone,18-Jun-18,Country,"Heather morgan, Ross copperman, Brett eldredge",
Lil Uzi Vert,Sanguine Paradise,9-Apr-19,"East Coast,Trap,Rap","Brandon finessin, Oogie mane, Lil uzi vert",
Eli Young Band,Love Ain't,25-May-18,Country,"Ross copperman, Ashley gorley, Shane mcanally",
"Pedro Capo, Farruko",Calma,5-Oct-18,"Puerto Rico,Reggaeton,Latin Music,Latin Pop,Latin Urban,Remix,En Espa\xc3\xb1ol,Pop","Rec808, Frank miami, George noriega, Sharo torres, Farruko, Pedro capo",
Jonas Brothers,Only Human,7-Jun-19,Pop,"Shellback, Joe jonas, Nick jonas, Kevin jonas",
Justin Moore,The Ones That Didn't Make It Back Home,12-Oct-18,Country,"Paul digiovanni, Justin moore, Jeremy stover, Chase mcgill",
Megan Thee Stallion,Big Ole Freak,11-Jun-18,Rap,Megan thee stallion,
NAV,Tap,22-Mar-19,"Canada,East Coast,Rap","London on da track, Westen weiss, Amir cash esmailian, Meek mill, Nav",Meek Mill
DJ Khaled,You Stay,17-May-19,"Atlanta,R&;B,Latin Music,En Espa\xc3\xb1ol,Rap","Clarence satch satchell, Blu june, Brittany coney, J balvin, Meek mill, Jeremih, Lil baby, Dj khaled, India","Meek Mill, J Balvin, Lil Baby, Jeremih"
"Ozuna, Daddy Yankee, J Balvin, Farruko, Anuel AA",Baila Baila Baila,25-Apr-19,"Latin Pop,Reggaeton,Remix,Puerto Rico,En Espa\xc3\xb1ol,Latin Urban,Latin Music,Pop","Anuel aa, Farruko, Ozuna, J balvin, Daddy yankee",
Megan Thee Stallion,Cash Shit,17-May-19,"East Coast,Rap","Dababy, Megan thee stallion",DaBaby
Drake,Omerta,15-Jun-19,"Hip-Hop,Basketball,NBA,Canada,Rap","Boi 1da, Deats, Ey, Oz, Drake",
Martin Garrix,Summer Days,25-Apr-19,"Electronic Pop,Electro,Electro House,Nederland,Electronic,Electro-Pop,Rap,Electronic Trap,Tropical House,Dance-Pop,Pop","Patrick stump, Jrm, Giorgio tuinfort, Brian lee, Macklemore, Martin garrix","Macklemore, Patrick Stump"
Billie Eilish,When The Party's Over,17-Oct-18,"R&;B,Ambient,Art Pop,Indie Pop,Ballad,Pop",Finneas,
Calboy,Envy Me,13-Sep-18,Rap,Calboy,
Kelsea Ballerini,Miss Me More,20-Oct-17,Country,"Leland, David hodges, Kelsea ballerini",
Dreamville,Down Bad,12-Jun-19,"East Coast,Atlanta,Rap","Pluss, Johnny venus, J cole, Young nudy, Bas, Jid","JID, Bas, J. Cole, EARTHGANG, Young Nudy"
Joji,Sanctuary,14-Jun-19,"Synth-Pop,Alternative R&;B,Pop,Ballad,Electronic","Joji, Luke niccoli, Justin raisen, Daniel wilson",
Marshmello,Rescue Me,14-Jun-19,"EDM,Pop-Punk,Electronic,Pop","Kevin skaff, Alex shelnutt, Joshua woodard, Neil westfall, Jeremy mckinnon, Marshmello",A Day To Remember
"Nicky Jam, Ozuna",Te Robare,22-Mar-19,"Reggaeton,Puerto Rico,Latin Urban,Latin Music,Latin Pop,En Espa\xc3\xb1ol,Pop","Juan diego medina velez, Huztle, Gaby music, Chris jeday, Ozuna, Nicky jam",
Juice WRLD,Robbery,13-Feb-19,"Trap,Emo Rap,Emo,Rap","Nick mira, Juice wrld",
Nipsey Hussle,Racks In The Middle,15-Feb-19,Rap,"Corbett, G dav, Hit boy, Roddy ricch, Nipsey hussle","Roddy Ricch, Hit"
Luke Combs,Beautiful Crazy,4-May-18,Country,"Wyatt b durrette, Robert williford, Luke combs",
Lil Baby,Close Friends,5-Oct-18,"Atlanta,Motown,Trap,Rap","Lil baby, Turbo",
Billie Eilish,Bury A Friend,30-Jan-19,"Trap,Alternative,Dark Pop,Industrial,Alternative Pop,Electronica,Pop","Billie eilish, Finneas",
Luke Combs,Even Though I'm Leaving,7-Jun-19,Country,"Ray fulcher, Wyatt b durrette, Luke combs",
Yo Gotti,Put A Date On It,25-Jan-19,Rap,"Lil baby, Yo gotti",Lil Baby
Avicii,Heaven,6-Jun-19,"Electro,EDM,Electro-Pop,Dance,Dance-Pop,Electronic,Scandipop,Scandinavia,Sverige,Pop","Chris martin, Avicii",
Future,Please Tell Me,7-Jun-19,"R&;B,Trap,Atlanta,Rap","Richie souf, Future",
Cody Johnson,On My Way To You,10-Aug-18,Country,"Tony lane, Brett james",
Ozuna,Amor Genuino,4-Jun-19,"Latin Pop,En Espa\xc3\xb1ol,Pop,Puerto Rico,Latin Music","Ozuna, Vicente saavedra",
Future,XanaX Damage,7-Jun-19,"Alternative R&;B,R&;B,Atlanta,Rap","Bobby raps, Kyle nelson, Will yanez, Future",
Future,Government Official,7-Jun-19,"Atlanta,Trap,Rap","Fxxxxy, Future",
Miley Cyrus,Mother's Daughter,31-May-19,"R&;B,LGBTQ+,Feminism,Pop","Alma, Andrew wyatt, Miley cyrus",
YNW Melly,Murder On My Mind,4-Mar-17,"Hip-Hop,Rap",Ynw melly,
NF,The Search,30-May-19,"Hip-Hop,Conscious Hip-Hop,Rap","Nf, Tommee profitt",
Joyner Lucas,Isis,7-May-19,"Trap,Hip-Hop,East Coast,DMV,Rap","Logic, Joyner lucas",Logic
Logic,Homicide,3-May-19,"Trap,Hip-Hop,DMV,Rap","Logic, Eminem, Chris delia, Luis resto, Tim schoegje, Donnell stephens iii, Dillan beau bailard, Jeremy alexander uribe",Eminem
Trippie Redd,Under Enemy Arms,29-May-19,Rap,"Mtk producer, Hammad beats, Trippie redd",
Jon Pardi,Night Shift,17-Jun-16,Country,"Billy montana, Phillip larue, Tofer brown",
21 Savage,A Lot,21-Dec-18,"East Coast,Trap,Rap","Sheila young, J white did it, Dj dahi, J cole, 21 savage",
Blueface,Thotiana,16-Feb-19,"Trap,Hip-Hop,West Coast,East Coast,Remix,Rap","Cardi b, Blueface",
DJ Khaled,Higher,17-May-19,"Neo Soul,West Coast,Rap","Henry davis, Kevin cossom, Nipsey hussle, John legend, Dj khaled","Nipsey Hussle, John Legend"
The Chainsmokers,Who Do You Love,7-Feb-19,"Future Bass,Dance-Pop,Dance,Australia,Pop","Alex pall, Andrew taggart, Talay riley, Oak, Sean douglas, Luke hemmings, Calum hood, Ashton irwin, Michael clifford, Trevorious, Zaire koalo",5 Seconds Of Summer
Mabel,Don't Call Me Up,18-Jan-19,"R&;B,UK,Pop","Kamille, Mabel, Steve mac",
Lil Dicky,Earth,19-Apr-19,"Memes,Charity,R&;B,Conscious Hip-Hop,Comedy,Satire,Afrobeats,UK,Climate Change,Pop,Hip-Hop,Rap","Lil dicky, Benny blanco, Cashmere cat, Jamil chammas, Ammo",
Lizzo,Juice,4-Jan-19,"Electro-Funk,Funk-Pop,Funk,Dance,Dance-Pop,Alternative Pop,Synth-Pop,R&;B","Theron thomas, Ricky reed, Lizzo",
Maluma,HP,1-Mar-19,"Colombia,Reggaeton,Latin Pop,Latin Music,Latin Urban,En Espa\xc3\xb1ol,Pop","Vicente barco, Edgar barrera, Jonathan rivera tapia, Giancarlos rivera tapia, Maluma",
YNW Melly,Mixed Personalities,18-Jan-19,"Rap,Trap","C clipbeatz, Kanye west, Ynw melly",Kanye West
Bazzi,Paradise,4-Apr-19,Pop,Bazzi,
Jhene Aiko,Triggered,8-May-19,"West Coast,R&;B","Brian warfield, Mac robinson, Ross james, Julian quan viet le, Jhene aiko",
Maroon 5,Girls Like You,30-May-18,"Pop-Rock,East Coast,Remix,Rap,Pop","Cardi b, Gian stone, Cirkut, Starrah, Adam levine, Jason evigan",Cardi B
"Tyler, The Creator",I Think,17-May-19,"Electro-Funk,Funk,Alternative Dance,Nu Disco,Disco,Nigeria,Rap,Neo Soul,Alternative R&;B,R&;B,Alternative,Experimental,West Coast","Nkono teles, Bibi mascel, Tyler the creator",
DJ Khaled,Celebrate,17-May-19,"Trap,Pop,R&;B","Naija, Teddy walton, Frank dukes, Post malone, Travis scott, Dj khaled","Travis Scott, Post Malone"
DJ Khaled,Jealous,17-May-19,"Rap,R&;B","Roger ball, Denisia andrews songs, Chris brown, James stewart, Owen mcintyre, Alan gorrie, Stephen ferrone, Malcolm duncan, Diana king, Kingsley gardner, Brittany coney, Blu june, Tay keith, Dj khaled, Lil wayne, Big sean","Chris Brown, Lil Wayne, Big Sean"
"Tyler, The Creator",Running Out Of Time,17-May-19,"Rap,Neo Soul,Alternative R&;B,R&;B,Experimental,Alternative,West Coast",Tyler the creator,
"Tyler, The Creator",Igor's Theme,17-May-19,"Alternative,Rap,Experimental","Lil uzi vert, Tyler the creator",
"Tyler, The Creator",New Magic Wand,17-May-19,"Experimental,Psychedelic Soul,Hip-Hop,Rap,Psychedelic,Alternative",Tyler the creator,
"Tyler, The Creator",A Boy Is A Gun,17-May-19,"Rap,Neo Soul,Alternative R&;B,Experimental,Alternative,West Coast,Alternative Pop,R&;B","Lester allen mckenzie, Bobby massey, Bobby dukes, Tyler the creator",
"Tyler, The Creator",What's Good,17-May-19,"Rap,Hardcore Hip-Hop,Experimental,Alternative,West Coast",Tyler the creator,
Lady Antebellum,What If I Never Get Over You,17-May-19,"Ballad,Country","Laura veltz, Ryan hurd, Jon green, Sam ellis",
"Tyler, The Creator",Puppet,17-May-19,"Rap,Neo-Psychedelia,Psychedelic,Experimental,Soul,Alternative,West Coast","Mick ware, Kanye west, David smith, Tyler the creator",
DJ Khaled,Weather The Storm,17-May-19,"Atlanta,Trap,Rap","Streetrunner, Tarik azzouz, Michel jouveaux, Dj khaled, Alec r costandinos, Lil baby, Meek mill","Meek Mill, Lil Baby"
Brett Young,Here Tonight,14-Sep-18,Country,"Charles kelley, Justin ebach, Ben caver, Brett young",
Dean Lewis,Be Alright,28-Jun-18,"Rock,Alternative Pop,Alternative Rock,Indie Pop,Indie Rock,Singer-Songwriter,Alternative,Indie,Australia,Pop","Jon hume, Dean lewis",
"Lil Baby, Gunna",Drip Too Hard,9-Sep-18,"Hip-Hop,Atlanta,Memes,Motown,Trap,Rap","Gunna, Lil baby, Turbo",
Ariana Grande,"Thank U, Next",3-Nov-18,"Dream-Pop,Memes,R&;B,Pop","Victoria monet, Ariana grande, Njomza, Kaydence, Michael mikey foster, Scootie, Tayla parx, Tbhits",
Pinkfong,Baby Shark,17-Jun-16,"Alternative Rock,Memes,Children&#39;s Music,Pop","Robin davies, Shawnee lamb",
Old Dominion,Make It Sweet,8-Oct-18,Country,"Whit sellers, Trevor rosen, Shane mcanally, Matthew thomas ramsey, Geoff sprung, Brad tursi",
Ella Mai,Shot Clock,12-Oct-18,"UK,R&;B","Mustard, Ella mai",
"Lauv, Troye Sivan",I'm So Tired...,24-Jan-19,Pop,"Lauv, Michael pollack, Troye sivan, Leland, Ozgo",
Billie Eilish,You Should See Me In A Crown,18-Jul-18,"Indie,Hip-Hop,Dark Pop,Alternative Pop,Alternative,Electro-Pop,Trap,Dream-Pop,Indie Pop,Pop","Billie eilish, Finneas",
Avicii,SOS,10-Apr-19,"Electro,Electronic,Electro-Pop,Dance-Pop,Dance,Scandipop,Scandinavia,West Coast,EDM,Sverige,Pop","Bonn, Kandi, Tameka tiny harris, Kevin briggs, Albin nedler, Avicii",Aloe Blacc
Billie Eilish,Wish You Were Gay,4-Mar-19,"Indie,Indie Pop,Alternative,Alternative Pop,Pop","Billie eilish, Finneas",
Lil Uzi Vert,That's A Rack,9-Apr-19,"East Coast,Trap,Rap","Oogie mane, Lil uzi vert",
2 Chainz,Rule The World,1-Mar-19,"R&;B,Rap","2 chainz, Cardiak, Hitmaka, Rob holladay, Lerron carson, Moore melvin ray iii, Racquelle rahky anteola, Rich harrison",Ariana Grande
Roddy Ricch,Die Young,3-Jul-18,"R&;B,Trap,Rap","Rex kudo, London on da track, Roddy ricch",
"Ellie Goulding, Diplo",Close To Me,24-Oct-18,"Electronic Trap,Dance-Pop,Trap,Electronic,Dance,Electro,Electro-Pop,Rap,Pop","Ellie goulding, Savan kotecha, Peter svensson, Ilya, Swae lee, Diplo",Swae Lee
Lauren Daigle,You Say,13-Jul-18,"Worship,Christian Pop,Pop,Christian","Paul mabury, Lauren daigle, Jason ingram",
A Boogie Wit da Hoodie,Swervin,21-Dec-18,"Trap,Rap","A boogie wit da hoodie, 6ix9ine, K rich, London on da track",6ix9ine
"SZA, The Weeknd, Travis Scott",Power Is Power,18-Apr-19,"Hip-Hop,Canada,Soundtrack,Rap,Pop","Sam harris, The weeknd, Belly, Ricky reed, Travis scott, Daheala, Myles martin, Sza, Victor dimotsis, Zach cooper",
"PnB Rock, XXXTENTACION",Middle Child,3-May-19,"Cloud Rap,Trap,Rap","Datkidchris, Xxxtentacion, Pnb rock",
"Lil Peep, iLoveMakonnen",I've Been Waiting,31-Jan-19,"Hip-Hop,Alternative,Alternative Rock,Emo Rap,Emo,Rap","Valentin leon blavatnik, Louis bell, Brian lee, Brenton duvall, Andy hurley, Patrick stump, Pete wentz, Joe trohman, Lil peep, Ilovemakonnen",Fall Out Boy
"Anuel AA, Karol G",Secreto,15-Jan-19,"Puerto Rico,Pop,Reggaeton,En Espa\xc3\xb1ol,Latin Music,Latin Urban","Prida, Ez el ezeta, Karol g, Anuel aa",
Ski Mask The Slump God,Faucet Failure,30-Nov-18,"Hip-Hop,Afro Trap,Trap,Rap","Cubeatz, Chasethemoney, Ski mask the slump god",
5 Seconds Of Summer,Youngblood,12-Apr-18,"New Wave,Pop,Synth-Pop,Electro-Pop,Alternative Pop,Australia,Pop-Rock,Rock","Watt, Louis bell, Ali tamposi, Ashton irwin, Calum hood, Luke hemmings",
ScHoolboy Q,Floating,26-Apr-19,"Rap,Gangsta Rap,Hip-Hop,Trap,West Coast","Kendrick lamar, Johnny juliano, Cardo, Schoolboy q, 21 savage",21 Savage
ScHoolboy Q + Travis Scott,CHopstix,8-Apr-19,"Rap,Hip-Hop,West Coast,Trap","Travis scott, Dj dahi, Kendrick lamar, Schoolboy q",
"Marshmello, Tyga, Chris Brown",Light It Up,25-Apr-19,"R&;B,West Coast,Electro House,Electro,Electronic,Rap","Judge, Marshmello, Chris brown, Tyga",
ScHoolboy Q,Numb Numb Juice,14-Mar-19,"Rap,Gangsta Rap,Hip-Hop,Trap,West Coast","Baby keem, Kendrick lamar, Nez and rio, Dj fu, Schoolboy q",
P!nk,Love Me Anyway,26-Apr-19,Pop,"Tom douglas, Allen shamblin, P nk",Chris Stapleton
BLACKPINK,Kill This Love,5-Apr-19,"Trap,Dance,Rap,Girl Group,Pop,Korean,K-Pop (\xec\xbc\x80\xec\x9d\xb4\xed\x8c\x9d)","Teddy park, Bekuh boom",
Post Malone,Better Now,27-Apr-18,"R&;B,Pop","Kaan gunesberk, William walsh, Carl rosen, Billy walsh, Frank dukes, Louis bell, Post malone",
Imagine Dragons,Bad Liar,6-Nov-18,"Rock,Adult Alternative,Ballad,Alternative Rock,Alternative,Pop-Rock,Indie Rock,Alternative Pop,Indie Pop,Pop","Imagine dragons, Jorgen odegard, Daniel platzman, Ben mckee, Wayne sermon, Aja volkman, Dan reynolds",
French Montana,Slide,18-Apr-19,"Trap,Hip-Hop,East Coast,West Coast,Rap",French montana,"Blueface, Lil Tjay"
"Khalid, Kane Brown",Saturday Nights,11-Jan-19,"Remix,Country,R&;B,Pop","Josh hoge, Charlie handsome, Kane brown, Jamil chammas, Khalid",
Lil Baby,Pure Cocaine,30-Nov-18,"Motown,Trap,Rap","Chris rosser, Lil baby",
Scotty McCreery,This Is It,7-May-18,Country,"Scotty mccreery, Aaron eshuis, Frank rogers",
Billie Eilish,My Strange Addiction,29-Mar-19,"Alternative Pop,Alternative,Pop",Finneas,
Alec Benjamin,Let Me Down Slowly,7-Jan-19,"Pop,Remix","Alessia cara, Alec benjamin, Sir nolan, Michael pollack",Alessia Cara
Billie Eilish,Xanny,29-Mar-19,"Indie,Alternative,Alternative Pop,Art Rock,Glam Rock,Indie Pop,Pop","Billie eilish, Finneas",
Michael Ray,One That Got Away,1-Jun-18,Country,"Matthew thomas ramsey, Trevor rosen, Josh osborne, Jesse frasure",
Bad Bunny,MIA,11-Oct-18,"Latin Urban,Reggaeton,Pop,Puerto Rico,Canada,Trap,R&;B,Rap,Latin Music,Latin Trap,En Espa\xc3\xb1ol","Edgar semper, Henry pulman, Francis diaz, Weezy kingz, Elvin pena, Noah assad, Joseph velez, Bad bunny, Drake, Dj luian",Drake
Dan + Shay,Tequila,10-Jan-18,Country,"Shay mooney, Jordan reynolds, Nicolle galyon, Dan smyers",
Cardi B,Money,23-Oct-18,"Hip-Hop,Trap,Rap","Klenord raphael, Pardison fontaine, Cardi b, J white did it",
Five Finger Death Punch,Blue On Black,12-Apr-19,Rock,"Tia sellers, Mark selby, Kenny wayne shepherd","Kenny Wayne Shepherd, Brantley Gilbert &"
Nipsey Hussle,Double Up,16-Feb-18,"West Coast,Rap","Teddy walton, Axl folie, Alexander chigbue, Nipsey hussle, Dom kennedy, Belly, Larrance dopson, John groover, Michael ray cox jr, David camon","Belly, DOM KENNEDY"
FLETCHER,Undrunk,25-Jan-19,Pop,"Fletcher, One love, Kinetics, Malay, Amy allen",
