Artists,Name,Date,Genre,Writing.Credits,Features
"Jennifer Lopez, Lin",Love Make The World Go Round,8-Jul-16,"Charity,LGBTQ+,Reggaeton,Pop","Johnny yukon, Lin manuel miranda, Jennifer lopez",
Kenny Chesney,Noise,25-Mar-16,Country,"Ross copperman, Jon nite, Shane mcanally, Kenny chesney",
Blake Shelton,Came Here To Forget,8-Mar-16,Country,"Craig wiseman, Deric ruttan",
Blink,Bored To Death,27-Apr-16,"Pop-Rock,Pop,Punk Rock,Pop-Punk,Rock","Matt skiba, Mark hoppus, John feldmann, Travis barker",
"Carlos Vives, Shakira",La Bicicleta,27-May-16,"En Espa\xc3\xb1ol,Pop","Shakira, Andres castro, Carlos vives",
O.T. Genasis,Cut It,25-Sep-15,Rap,"Ot genasis, Young dolph",Young Dolph
Jeremih,Oui,30-Oct-15,R&;B,"Needlz, Kendall manuel jackson, Andrews bonsu, Carl groove martin, Donut, Jeremih",
Alessia Cara,Wild Things,2-Feb-16,"Canada,Pop","Thabiso tab nkhereanye, Alessia cara, Coleridge tillman, James ho",
Disturbed,The Sound Of Silence,21-Aug-15,"Folk Rock,Nu-Metal,Metal,Hard Rock,Alternative Rock,Cover,Ballad,Rock",Paul simon,
Pitbull,Messin' Around,8-Apr-16,"Trap,Rap","Jimmy joker, Jose garcia, Michael calderon, Aj junior, Jorge gomez, Gary richrath, Enrique iglesias, Pitbull",Enrique Iglesias
Drake,Still Here,29-Apr-16,"Canada,Rap","Lil wayne, 40, Daxz, Drake",
Drake,Hype,29-Apr-16,"Trap,Canada,Rap","Cubeatz, The beat bully, Boi 1da, Drake",
Logic,Flexicution,13-Jun-16,"Trap,Rap",Logic,
Kevin Gates,Really Really,5-Oct-15,Rap,"Kevin gates, Cook classics, Alex goose, Jake troth",
Drake,Grammys,29-Apr-16,"Trap,Canada,Rap","Future, Yung exclusive, Southside, Cardo, 40, Drake",Future
Shakira,Try Everything,15-Feb-16,"Disney,Soundtrack,Pop",Sia,
Red Hot Chili Peppers,Dark Necessities,5-May-16,"Adult Alternative,Funk Rock,Alternative Rock,Rock","Danger mouse, Josh klinghoffer, Flea, Chad smith, Anthony kiedis",
Kevin Gates,2 Phones,5-Nov-15,"Memes,Trap,Rap","Mad max, Kevin gates, Starrah",
Tim McGraw,Humble And Kind,6-Sep-15,Country,Lori mckenna,
Kane Brown,Ain't No Stopping Us Now,2-Dec-16,Country,"Jordan schmidt, Jamie paulin, Kane brown",
Rihanna,Kiss It Better,28-Jan-16,"Synth Rock,Pop,R&;B","Teddy sinclair, Glass john, Jeff bhasker, Rihanna",
Bryson Tiller,Exchange,21-Sep-15,"Boom Bap,Singer-Songwriter,Dark Pop,Soul Pop,Hardcore Hip-Hop,Conscious Hip-Hop,Pop,Dancehall,Soul,Trap,Rap,R&;B","Foreign teck, Javelyn hall, Michael johnson, Bryson tiller",
Dierks Bentley,Somewhere On A Beach,19-Jan-16,Country,"Michael tyler, Jaron boyer, Alex palmer, Dave kuncio, Josh mirenda",
Jacob Sartorius,Sweatshirt,3-May-16,"Memes,Dance,Rock,Pop",Jacob sartorius,
Drake,With You,29-Apr-16,"Canada,Rap","Cardiak, Murda beatz, Nineteen85, Partynextdoor, Drake",PARTYNEXTDOOR
Belly,Might Not,7-May-15,"Canada,R&;B,Rap","Ben billions, Merlin watts, Daheala, The weeknd, Belly",The Weeknd
Alan Walker,Faded,3-Dec-15,"Progressive House,House,Electronic,Pop","Mood melodies, Alan walker, Jesper borgen, Gunnar greve pettersen",
DJ Snake,Middle,16-Oct-15,"Gaming,Soundtrack,Electronic,Pop","Bipolar sunshine, Dj snake, Aalias",Bipolar Sunshine
Maren Morris,My Church,19-Jan-16,"Gospel,Pop Country,Country","Busbee, Maren morris",
Old Dominion,Snapback,11-Jan-16,Country,"Trevor rosen, Matthew thomas ramsey, Brad tursi",
Mike WiLL Made,Nothing Is Promised,3-Jun-16,"Pop,Trap,Rap","James fauntleroy, Pluss, Mike will made it, Rihanna, Future",
Dustin Lynch,Mind Reader,28-Sep-15,Country,"Ben hayslip, Rhett akins",
Beyonce,Formation,6-Feb-16,"R&;B,Pop","Pluss, Jordan frost, Mike will made it, Swae lee, Beyonce",
Drake,Feel No Ways,29-Apr-16,"Hip-Hop,Canada,Rap","Anne dudley, Future, 40, Jordan ullman, Drake",
Yo Gotti,Law,19-Feb-16,Rap,"K camp, Big fruit, E 40, Yo gotti",E
Kelly Clarkson,Piece By Piece,9-Nov-15,"Electro-Pop,Orchestral,Pop","Greg kurstin, Kelly clarkson",
Young Greatness,Moolah,20-Nov-15,Rap,"Jazze pha, Young greatness",
Troye Sivan,Youth,13-Nov-15,Pop,"Leland, Alex hope, Allie x, Bram inscore, Troye sivan",
Ghost Town DJ's,My Boo,,"Memes,R&;B,Pop","Lil jon, Rodney terry, Carlton mahone",
Jason Derulo,If It Ain't Love,1-Apr-16,"R&;B,Pop","Jordan k johnson, Lindy robbins, Talay riley, Jason derulo",
Drake,9,29-Apr-16,"Canada,Rap","David harrisingh, Craig harrisingh, Serani, Mavado, Brian alexander morgan, Boi 1da, 40, Drake",
Charlie Puth,One Call Away,20-Aug-15,Pop,"Shy carter, Breyan isaac, Matt prime, Mozella, Charlie puth, Dj frank e",
Drake,U With Me?,29-Apr-16,"Canada,Rap","Faith evans, Axel morgan singer, Dave goode, Nokio the n tity, Phillip weatherspoon, Anthony fields, Dmx, Partynextdoor, Oz, Ricci riera, Vinylz, Dj dahi, Kanye west, Drake",
Drake,Fire & Desire,29-Apr-16,"Canada,Rap","Curtis sauce wilson, William young, Brandy, Rocho holiday, 40, Drake",
Drake,Redemption,29-Apr-16,"Canada,Rap","40, Drake",
Alisan Porter,Down That Road,23-May-16,"Country,Pop",,
Shawn Mendes,Stitches,15-Mar-15,Pop,"Daniel parker, Teddy geiger, Daniel kyriakides",
The Chainsmokers,Roses,16-Jun-15,"Future Bass,Dance-Pop,Dance,Electro-Pop,Electronic,Pop","The chainsmokers, Rozes",Rozes
Bryson Tiller,Don't,28-Oct-14,"Boom Bap,Singer-Songwriter,Dark Pop,Soul Pop,Soul,Rap,Trap,Alternative R&;B,R&;B","Vory, Jermaine dupri, Isom brandon stuart, Epikh pro, Mariah carey, Dope boi beatz, Bryson tiller",
Drake,Weston Road Flows,29-Apr-16,"Canada,Rap","Edgar key, D carty, J levine, C thompson, Diddy, Mary j blige, 40, Drake",
Drake,Keep The Family Close,29-Apr-16,"Ballad,Pop,Canada,Rap","Maneesh, Drake",
Drake,Faithful,29-Apr-16,"Canada,Rap","Bryan michael cox, Kevin hicks, Johnta austin, Boi 1da, Nineteen85, Dvsn, Pimp c, Drake","Pimp C, dvsn"
Chance The Rapper,Blessings,13-May-16,"Gospel,Christian,Rap","Fred hammond, Peter cottontale, Nate fox, Chance the rapper, Cam obi",Ty Dolla $ign
Kid Ink,Promise,25-Dec-15,Rap,"Twice as nice, Robin weisse, Mustard, Fetty wap, Kid ink",Fetty Wap
Blake Shelton,Go Ahead And Break My Heart,9-May-16,Country,"Gwen stefani, Blake shelton",Gwen Stefani
Jennifer Lopez,Ain't Your Mama,7-Apr-16,Pop,"Meghan trainor, Jacob kasher, Cirkut, Theron thomas, Lunchmoney lewis, Dr luke",
Beyonce,6 Inch,23-Apr-16,"Canada,R&;B,Pop","Bacharach and david, Danny boy styles, Ben billions, Geologist, Avey tare, Panda bear, Hal david, Burt bacharach, Boots, Belly, The dream, Beyonce, The weeknd",The Weeknd
Rascal Flatts,I Like The Sound Of That,13-May-14,Country,"Shay mooney, Jesse frasure, Meghan trainor",
Florida Georgia Line,Confession,14-Oct-14,"Country,Rock","Matt jenkins, Ross copperman, Rodney clawson",
Iggy Azalea,Team,18-Mar-16,"Aussie Hip-Hop,Australia,Electro-Hop,Electronic,Pop,Rap","Brandon stix salaam bailey, Marlon chordz barrow, Juvenile, Louis harden, Ryan anthony avilez, Michael fonseca, Fuego, Drugs, Bebe rexha, Lauren christy, Iggy azalea",
Beyonce,Don't Hurt Yourself,23-Apr-16,"Pop-Rock,Rock,Pop","Diana gordon, John bonham, John paul jones, James page, Robert plant, Beyonce, Jack white",Jack White
Beyonce,All Night,23-Apr-16,"Pop,R&;B","Jrm, R city, Big boi, Sleepy brown, Andre 3000, Worldwide fresh, Ilsey, Theron thomas, Timothy thomas, Beyonce, Diplo",
Beyonce,Freedom,23-Apr-16,"West Coast,Rap,R&;B","John lomax, Jonny coffer, Alan lomax, Frank tirado, Kendrick lamar, Dean mcintosh, Carla marie, Beyonce",Kendrick Lamar
Beyonce,Daddy Lessons,23-Apr-16,"Country,Bluegrass","Diana gordon, Kevin cossom, Alex delicata, Beyonce",
Beyonce,Pray You Catch Me,23-Apr-16,"Pop,R&;B","James blake, Beyonce, Kevin garrett",
Beyonce,Sandcastles,23-Apr-16,"Ballad,R&;B,Pop","Midian mathers, Vincent berry ii, Malik yusef, Beyonce",
Beyonce,Love Drought,23-Apr-16,"R&;B,Pop","Ingrid, Beyonce, Mike dean",
"Zedd, Kesha",True Colors,29-Apr-16,Pop,"Tim james, Antonina armato, Zedd",
Drake,Views,29-Apr-16,"Canada,Rap","Maneesh, Boi 1da, Voyce, Drake",
Drake,Summer Sixteen,31-Jan-16,"Beef,Canada,Rap",Drake,
Prince And The Revolution,Purple Rain,,"Eighties,Soul,Soul Pop,Pop,Soundtrack,R&;B,Rock",Prince,
Prince,When Doves Cry,,"Eighties,Soundtrack,Funk,Pop,R&;B,Rock",Prince,
Prince,Little Red Corvette,,"Synth-Pop,New Wave,Pop,Rock,R&;B",Prince,
Prince And The Revolution,Kiss,,"Pop,Funk,R&;B,Rock",Prince,
Prince And The Revolution,Let's Go Crazy,,"Soundtrack,Funk,R&;B,Rock",Prince,
Prince,1999,,"Dance,Funk,Pop,Rock",Prince,
Prince And The Revolution,Raspberry Beret,,"Eighties,Pop,R&;B,Rock",Prince,
Prince And The Revolution,I Would Die 4 U,,"Eighties,Soundtrack,Pop,Funk,R&;B,Rock",Prince,
"Drake, Future",Jumpman,20-Sep-15,"Trap,Canada,Rap","Metro boomin, Future, Drake",
Beyonce,Forward,23-Apr-16,"R&;B,Pop","Beyonce, James blake",James Blake
Chris Brown,Back To Sleep,26-Feb-16,"Pop,Rap,Remix,R&;B","Chris brown, Usher, Zayn, Allen ritter, Boi 1da, Vinylz",
Cole Swindell,You Should Be Here,14-Dec-15,Country,"Cole swindell, Ashley gorley",
A$AP Ferg,New Level,18-Dec-15,"Atlanta,East Coast,Trap,Rap","Da honorable cnote, A ap ferg, Future",Future
Justin Bieber,Company,8-Mar-16,"Electronic,Dance-Pop,Dance,Canada,Pop","Gladius, Jhart, Big taste, Poo bear, Thomas troelsen, Justin bieber",
The Weeknd,Acquainted,28-Aug-15,"Canada,Pop,R&;B","Danny boy styles, Ben billions, Daheala, The weeknd, Illangelo",
Lee Brice,That Don't Sound Like You,11-May-15,Country,"Lee brice, Rhett akins, Ashley gorley",
Selena Gomez,Hands To Myself,26-Jan-16,Pop,"Robin fredriksson, Mattias larsson, Justin tranter, Julia michaels, Max martin",
Adele,Hello,23-Oct-15,"Adult Alternative,Adult Contemporary,Ballad,Piano,Soul,Memes,UK,Pop","Adele, Greg kurstin",
Yo Gotti,Down In The DM,19-Feb-16,Rap,"Yo gotti, Ben billionaire, Dj khaled, Ian lewis, Nicki minaj",Nicki Minaj
The Weeknd,The Hills,27-May-15,"Trap,Alternative R&;B,Canada,Pop,R&;B","Belly, The weeknd, Mano, Illangelo",
Taylor Swift,New Romantics,3-Mar-15,"New Wave,Synth-Pop,Pop","Shellback, Max martin, Taylor swift",
Brett Eldredge,Drunk On Your Love,11-Sep-15,Country,,
Ty Dolla $ign,Saved,16-Oct-15,Rap,"Bobby brackins, Nick audino, Lewis hughes, Gizzle, Mustard, E 40, Ty dolla sign",E
Chase Bryant,Little Bit Of You,,Pop,,
DJ Luke Nasty,Might Be,8-Sep-15,Rap,"Anderson paak, Dj luke nasty",
Kanye West,Pt. 2,14-Feb-16,"Experimental,Trap,Rap","Menace, Caroline shaw, Plain pat, Rick rubin, Kanye west, Cyhi the prynce",
Fetty Wap,Jimmy Choo,4-Nov-15,Rap,Fetty wap,
Ariana Grande,Let Me Love You,18-Apr-16,"Trap,R&;B,Rap,Pop","Ob obrien, Fki 1st, Jeremih, Mr franks, Tbhits, Lil wayne, Victoria monet, Ariana grande",Lil Wayne
Jonas Blue,Fast Car,4-Dec-15,"Dance-Pop,UK,Dance,Pop",Tracy chapman,Dakota
Thomas Rhett,Die A Happy Man,25-Sep-15,Country,"Sean douglas, John ward, Thomas rhett",
Chris Stapleton,Nobody To Blame,9-Nov-15,Country,"Ronnie bowman, Barry bales, Chris stapleton",
Kanye West,Waves,14-Feb-16,"DMV,Gospel,R&;B,Trap,Rap","Hudson mohawke, Fred brathwaite, Partynextdoor, Darryl mason, Robin diggs, Kevin ferguson, Theodore livingston, Mesh germany, Noah goldstein, Malik yusef, A williams, Charlie heat, Metro boomin, Mike dean, Fonzworth bentley, Elon rutberg, Kanye west, Cyhi the prynce, Kid cudi, Chris brown, Chance the rapper",
Robin Schulz,Sugar,17-Jul-15,"Electronic,Dance,Pop","Jurgen dohr, Kramer, Guido, Dennis bierbrodt, Baby bash, Happy perez, Frankie j, Robin schulz, Francesco yates",Francesco Yates
Kanye West,Ultralight Beam,14-Feb-16,"Hip-Hop,Gospel,Christian,Rap","Fonzworth bentley, Samo sound boy, Jerome lol, Noah goldstein, Swizz beatz, Nico segal, Kelly price, Cyhi the prynce, Mike dean, The dream, Kirk franklin, Chance the rapper, Kanye west",
Panic! At The Disco,Victorious,29-Sep-15,"Rock,Synth-Pop,Power Pop,Pop-Rock,Pop","Morgan kibby, White sea, Cj baran, Mike viola, Jake sinclair, Rivers cuomo, Alex deleon, Brendon urie",
Drake,Hotline Bling,25-Jul-15,"Hip-Hop,Rap,Producer,Pop,R&;B,Memes,Canada","Timmy thomas, Nineteen85, Drake",
Adele,When We Were Young,20-Nov-15,"Piano,Ballad,Soul,UK,Pop","Tobias jesso jr, Adele",
Young Thug,Best Friend,14-Sep-15,"Atlanta,Memes,Trap,Rap",Young thug,
Kanye West,FML,14-Feb-16,"Alternative R&;B,R&;B,Canada,Rap","Hudson mohawke, Keyon christ, Darius 3d jenkins, K rachel mills, Charlie heat, Metro boomin, Noah goldstein, Andrew dawson, Mike dean, Travis scott, Cyhi the prynce, The weeknd, Kanye west",
Chris Stapleton,Tennessee Whiskey,4-Nov-15,Country,"Linda hargrove, Dean dillon",
Kanye West,Real Friends,8-Jan-16,"West Coast,Rap","Gizzle, Rupert thomas, Noah goldstein, Mike dean, Ty dolla sign, Darren king, Havoc, Frank dukes, Boi 1da, Kanye west, Cyhi the prynce",
Zac Brown Band,Beautiful Drug,21-Sep-15,Country,"Zac brown, Niko moon",
Carrie Underwood,Heartbeat,30-Nov-15,Country,"Ashley gorley, Zach crowell, Carrie underwood",
Kanye West,Feedback,14-Feb-16,"Industrial,Experimental,Producer,Rap","Darius 3d jenkins, Noah goldstein, Charlie heat, Kanye west, Chance the rapper, Cyhi the prynce",
Fetty Wap,679,29-Jun-15,"R&;B,Trap,Rap","Remy boyz, Fetty wap",Remy Boyz
Justin Bieber,What Do You Mean?,28-Aug-15,"Canada,Tropical House,Electro-Pop,Electronic,Pop","Justin bieber, Mdl, Poo bear",
Tory Lanez,Say It,31-Jul-15,"Alternative R&;B,Trap,Rap,Canada,R&;B","Dave jam hall, Gordon chambers, Nicci gilbert, Autoro toro whitfield, Andrew pop wansel, Tory lanez",
Meghan Trainor,Like I'm Gonna Lose You,9-Jan-15,Pop,"Caitlyn smith, Meghan trainor, Justin weaver",John Legend
Post Malone,White Iverson,4-Feb-15,"Hip-Hop,Cloud Rap,Trap,Memes,Sports,Rap","Fki 1st, Fki, Andre dwayne jackson, Post malone",
Zayn,Like I Would,10-Mar-16,"R&;B,UK,Pop","James griffin, James emerson, Chase wells, Kevin rains, Salvador waviest, Zayn",
Rachel Platten,Stand By You,11-Sep-15,Pop,"Matt morris, Joy williams, Jack antonoff, Rachel platten",
"Shawn Mendes, Camila Cabello",I Know What You Did Last Summer,18-Nov-15,Pop,"Bill withers, Noel zancanella, Ido zmishlany, Camila cabello, Shawn mendes",
Young Thug,With Them,25-Mar-16,"Atlanta,Trap,Rap","Mike will made it, Resource, Young thug",
Luke Bryan,Home Alone Tonight,23-Nov-15,Country,"Cole taylor, Jody stevens, Jaida dreyer, Tommy cecil",Karen Fairchild
Young Thug,Digits,25-Mar-16,"Atlanta,Trap,Rap","London on da track, Young thug",
Ellie Goulding,Something In The Way You Move,19-Jan-16,Pop,"Ellie goulding, Greg kurstin",
Gwen Stefani,Make Me Like You,12-Feb-16,Pop,"Mattman and robin, Julia michaels, Justin tranter, Gwen stefani",
Ariana Grande,Be Alright,18-Mar-16,Pop,"Ariana grande, Victoria monet, Nicholas audino, Lewis hughes, Tbhits, Willie tafa, Khaled rohaim",
Daya,Hide Away,22-Apr-15,"Electro-Pop,Pop","Leland, Scott bruzenak, Britten newbill, Farrago",
Alessia Cara,Here,27-Apr-15,"Producer,Pop,R&;B","Sebastian kole, Alessia cara",
Selena Gomez,Same Old Love,10-Sep-15,Pop,"Mikkel storleer eriksen, Benny blanco, Ross golan, Charli xcx, Tor erik hermansen",
Elle King,Ex's & Oh's,23-Sep-14,"Adult Contemporary,Adult Alternative,Blues Rock,Alternative Country,Alternative Rock,Pop-Rock,Rock,Pop","Kristopher gregory, Dave bassett, Elle king",
The Weeknd,In The Night,28-Aug-15,"Canada,Pop,R&;B","The weeknd, Belly, Ali payami, Peter svensson, Savan kotecha, Max martin",
Coldplay,Adventure Of A Lifetime,6-Nov-15,"Dance-Pop,Disco,Pop,Rock","Mikkel storleer eriksen, Tor erik hermansen, Guy berryman, Will champion, Jonny buckland, Chris martin",
Granger Smith,Backroad Song,5-Oct-15,Country,"Frank rogers, Granger smith",
Zendaya,Something New,3-Feb-16,"R&;B,Pop","Chrishan, Zendaya, Antonio dixon, Kyle coleman, Bobby brackins, Dallas austin, Leon thomas iii, Babyface, Khris riddick tynes",Chris Brown
Bryson Tiller,Sorry Not Sorry,2-Oct-15,"Boom Bap,Dark Pop,Singer-Songwriter,Soul Pop,Hardcore Hip-Hop,Pop,Conscious Hip-Hop,Dancehall,Soul,Trap,Rap,R&;B","Millibeatz, Timbaland, Bryson tiller",
The Weeknd,Can't Feel My Face,8-Jun-15,"Indie Pop,Soul Pop,Alternative R&;B,Nu Disco,Funk,Canada,Pop,R&;B","Ali payami, Peter svensson, Savan kotecha, Max martin, The weeknd",
Randy Houser,We Went,18-May-15,Country,"King gizmo, Matt rogers, Justin wilson",
Keith Urban,Break On Me.,19-Oct-15,Country,"Ross copperman, Jon nite",
2 Chainz,Watch Out,13-Aug-15,Rap,"Saucelordrich, Fki 1st, 2 chainz",
Jason Derulo,Get Ugly,15-Dec-15,"Pop,R&;B","Ricky reed, Sean douglas, Jason evigan, Jason derulo",
2 Chainz,Gotta Lotta,3-Mar-16,Rap,"Lil wayne, 2 chainz, Antonio nunzio catania, John larkin",Lil Wayne
Travis Scott,Antidote,23-Jun-15,"Trap,Hip-Hop,Memes,Rap","Nick movshon, Eestbound, Wondagurl, Homer steinweiss, Leon michels, Dave guy, Thomas brenneck, Travis scott",
Wiz Khalifa,See You Again,9-Mar-15,"Hip-Hop,Piano,Pop,Memorial,Soundtrack,Rap","Dj frank e, Andrew cedar, Charlie puth, Wiz khalifa",Charlie Puth
Zayn,It's You,25-Feb-16,"UK,R&;B","James ho, Harold lilly, Zayn",
Flo Rida,Hello Friday,26-Feb-16,Rap,"Thomas troelsen, Breyan isaac, Robin weisse, Flo rida",Jason Derulo
One Direction,Perfect,16-Oct-15,"Boy Band,UK,Pop","Mozella, John ryan, Jacob kasher, Jesse shatkin, Julian bunetta, Louis tomlinson, Harry styles",
Lady Gaga,Til It Happens To You,15-Sep-15,"Screen,Pop","Diane warren, Lady gaga",
Empire Of The Sun,Walking On A Dream,3-Oct-08,"Adult Alternative,Soundtrack,Pop,Dance-Pop,Alternative Rock,Alternative Pop,Alternative Dance,Psychedelic Rock,Synth Rock,Synth-Pop,New Wave,Pop-Rock,Indie Rock,Indie Pop,Rock","Donnie sloan, Nick littlemore, Luke steele",
One Direction,History,6-Nov-15,"Boy Band,UK,Pop","Louis tomlinson, John ryan, Liam payne, Wayne hector, Ed drewett, Julian bunetta",
Taylor Swift,Wildest Dreams,27-Oct-14,"Dream-Pop,Pop","Shellback, Max martin, Taylor swift",
Kelsea Ballerini,Dibs,20-Jul-15,Country,"Jason duke, Ryan griffin, Theophilus london, Kelsea ballerini",
Taylor Swift,Out Of The Woods,14-Oct-14,"Electro-Pop,Synth-Pop,Pop","Jack antonoff, Taylor swift",
Tori Kelly,Hollow,22-Oct-15,"Christian,Pop","Hayley warner, Thom macken, Lindsey jackson, Tori kelly, Zac poor",
Migos,Look At My Dab,17-Sep-15,"Trap,Dab,Memes,Rap","Offset, Takeoff, Quavo",
LOCASH,I Love This Life,,Country,"Danny myrick, Chris janson, Chris lucas, Preston brust",
Sam Hunt,Break Up In A Small Town,27-Oct-14,Country,"Shane mcanally, Zach crowell, Sam hunt",
Ellie Goulding,On My Mind,17-Sep-15,"Gaming,Soundtrack,Pop","Ilya, Savan kotecha, Max martin, Ellie goulding",
Demi Lovato,Confident,18-Sep-15,"Pop-Rock,Marvel,Pop","Ilya, Max martin, Savan kotecha, Demi lovato",
Brothers Osborne,Stay A Little Longer,10-Mar-15,Country,"Shane mcanally, Tj osborne, John osborne",
Adele,All I Ask,20-Nov-15,"UK,Pop","Brody brown, Philip lawrence, Bruno mars, Adele",
Andy Grammer,Good To Be Alive,24-Aug-15,Pop,"Ryan met, Andy grammer",
David Guetta,Bang My Head,30-Oct-15,Pop,"Magnus lidehall, Vincent pontare, Sia, Bloodshy, Marcus van wattum, Giorgio tuinfort, David guetta","Sia, Fetty Wap"
Fall Out Boy,Irresistible,19-Feb-15,"Pop-Punk,Punk Rock,Alternative Rock,Pop-Rock,Pop,Rock","Andy hurley, Joe trohman, Patrick stump, Pete wentz",
DLOW,Do It Like Me,4-Jun-10,Rap,Dlow,
Dawin,Dessert,17-Mar-15,R&;B,"Timothy mingo, Ricky hawk, Dawin",
Silento,Watch Me,27-Apr-15,"Pop,Rap","Silento, Timothy mingo",
Future,Fly shit Only,4-Feb-16,"Trap,Rap","John mcgee, Dj spinz, Future",
Nelly,Die A Happy Man,,Rap,,
Missy Elliott,WTF,12-Nov-15,Rap,"Pharrell williams, Missy elliott",Pharrell Williams
Chase Rice,Whisper,5-Feb-16,Country,"Chris destefano, Jonathan nite, Chase rice",
Nelly,The Fix,14-Aug-15,"R&;B,Rap","Devo d, Mustard, Mike free, Nelly, Jeremih, David ritz, Odell brown, Marvin gaye, Kquick, Ceresia blanchard, Mikely adams",Jeremih
J. Cole,No Role Modelz,9-Dec-14,"Producer,Rap",J cole,
Fetty Wap,Again,13-Aug-15,"Trap,R&;B,Rap",Fetty wap,
"Drake, Future",Big Rings,20-Sep-15,"Canada,Trap,Rap","Future, Drake",
Brad Paisley,Country Nation,25-Aug-14,"Country,Pop","Kelly love, Chris dubois, Brad paisley",
DeJ Loaf,Back Up,15-Jul-15,Rap,"Clenton gosberry, Kyle adams, Dej loaf, Big sean",Big Sean
Kevin Gates,Jam,29-Jan-16,"R&;B,Rap","Kevin gates, Trey songz, Babyface, Ty dolla sign, Micah powell, Jamie foxx, Boaz watson, Belinda lipscomb","Trey Songz, Ty Dolla $ign, Jamie Foxx"
Sia,Alive,24-Sep-15,"Australia,Pop","Tobias jesso jr, Adele, Sia",
Big Sean,Play No Games,22-Sep-15,"R&;B,Rap","Teddy riley, Aaron hall, Gene griffin, Justin johnson, Timothy gatling, Ty dolla sign, Chris brown, Big sean, Key wane, Jay john henry","Chris Brown, Ty Dolla $ign"
Jana Kramer,I Got The Boy,27-Jan-15,Country,"Jamie lynn, Connie harrington, Tim nichols",
Eric Church,Mr. Misunderstood,4-Nov-15,Country,"Casey beathard, Eric church",
Ariana Grande,Focus,30-Oct-15,Pop,"Ilya, Peter svensson, Savan kotecha, Ariana grande",
Jason Aldean,Gonna Know We Were Here,17-Aug-15,"Country,Rock","Brett james, Brett beavers",
Panic! At The Disco,Emperor's New Clothes,21-Oct-15,"Emo,Pop-Rock,Pop,Rock","Lauren pritchard, Dan wilson, Sam hollander, Jake sinclair, Brendon urie",
Curren$Y,Bottom Of The Bottle,4-Dec-15,Rap,"August alsina, Lil wayne, Curren y","August Alsina, Lil Wayne"
R. City,Locked Away,29-Jun-15,"Dancehall,Reggae,R&;B,Rap,Pop","Theron thomas, Timothy thomas, Toni tennille, Cirkut, Dr luke, Adam levine",Adam Levine
Justin Bieber,I'll Show You,2-Nov-15,"Canada,Electro-Pop,Electronic,Pop","Ron neff u feemster, Josh gudwin, Bloodpop, Skrillex, Justin bieber",
Halsey,New Americana,10-Jul-15,"Alternative,Alternative Pop,Pop","Kalkutta, James mtume, Lazz principato, Halsey",
Panic! At The Disco,Death Of A Bachelor,24-Dec-15,"Swing,R&;B,Jazz,Synth-Pop,Pop","Lauren pritchard, Jake sinclair, Brendon urie",
Rudimental,Lay It All On Me,24-Sep-15,"UK,Pop","Johnny ghostwriter harris, Amir amor, Kesi dryden, Piers aggett, James newman, Ed sheeran, Gavin slate, Leon locksmith rolle, Adam eaglefield, Lasse petersen, Max mcelligott, Jacob manson, James wood",Ed Sheeran
Drake,Right Hand,27-Jul-15,"Canada,Rap","Velous, Adam feeney music, Kaan gunesberk, Vinylz, Drake",
Rae Sremmurd,Come Get Her,6-Jan-15,Rap,"Marz, Slim jxmmi, Swae lee, Rae sremmurd, Mike will made it",
J Balvin,Ginza,17-Jul-15,"Rap,Latin Music,Reggaeton,En Espa\xc3\xb1ol","Bull nene, Mosty, J balvin, Sky rompiendo, Feid",
Fetty Wap,Trap Queen,8-Mar-14,"Hip-Hop,Memes,R&;B,Rap,Trap",Fetty wap,
David Bowie,Lazarus,15-Dec-15,"Art Pop,UK,Art Rock,Jazz,Rock",David bowie,
David Bowie,Space Oddity,,"Psychedelic,Progressive Rock,Baroque Pop,Space Rock,Folk Rock,Psychedelic Rock,Art Rock,UK,Rock",David bowie,
"Queen, David Bowie",Under Pressure,,"Adult Alternative,British Rock,Pop-Rock,New Wave,Pop,UK,Rock","David bowie, John deacon, Brian may, Roger taylor, Freddie mercury",
David Bowie,Blackstar,8-Nov-15,"Experimental,British Rock,UK,Avant Garde,Drum &; Bass,Electronic,Experimental Rock,Progressive Rock,Jazz,Art Rock,Rock",David bowie,
Gwen Stefani,Used To Love You,17-Oct-15,Pop,"Teal douville, Julia michaels, Jr rotem, Justin tranter, Gwen stefani",
Blake Shelton,Gonna,3-Aug-15,"Country,Pop","Craig wiseman, Luke laird",
Fetty Wap,RGF Island,25-Sep-15,"East Coast,R&;B,Trap,Rap","Modi songwriter, Fetty wap",
Ty Dolla $ign,Blase,16-Jun-15,Rap,"Dj spinz, Slim jxmmi, Swae lee, Future, Ty dolla sign","Future, Rae Sremmurd"
Future,Where Ya At,17-Jul-15,"Atlanta,Trap,Rap","Metro boomin, Future, Drake",Drake
"Macklemore, Ryan Lewis",Downtown,27-Aug-15,"Funk,Pop,Rap","Josh rawlings, Ryan lewis, Darian asplund, Tim haggerty, Evan flory barnes, J dutton, Budo, Eric nally, Macklemore","Eric Nally, Melle Mel, Kool Moe Dee &"
Tim McGraw,Top Of The World,4-Aug-15,Country,"Jon nite, Jimmy robbins, Josh osborne",
Carrie Underwood,Smoke Break,21-Aug-15,Country,"Chris destefano, Carrie underwood, Hillary lindsey",
iLoveMemphis,Hit The Quan,14-Jul-15,Rap,Ilovememphis,
Cam,Burning House,31-Mar-15,Country,"Tyler johnson, Jeff bhasker, Cam",
Chris Brown,Liquor,26-Jun-15,R&;B,"Jordan evans, Tone stith, Chris brown, Boi 1da",
Future,Stick Talk,1-Feb-15,"Atlanta,Trap,Rap","Southside, Future",
Justin Bieber,The Feeling,13-Nov-15,"Canada,Pop","Clarence coffee jr, Ian kirkpatrick, Skrillex, Sarah hudson, Julia michaels, Justin bieber",Halsey
Chris Brown,Zero,18-Sep-15,"Funk,Disco,R&;B","Sean douglas, Tushar apte, Matthew burnett, Talay riley, Chris brown",
Fetty Wap,Jugg,25-Sep-15,"R&;B,Trap,Rap","Monty, Remy boyz, Fetty wap",Monty
Lindsey Stirling,Hallelujah,7-Dec-15,Pop,Leonard cohen,
Chris Brown,Little More,18-Dec-15,"Electronic,Dance-Pop,Dance,Pop","Danusk, Poo bear, Razihel, The audibles, Chris brown",
Jordan Smith,Mary Did You Know,14-Dec-15,Pop,"Buddy greene, Mark lowry",
Selena Gomez,Good For You,22-Jun-15,"Rap,Pop","Julia michaels, Justin tranter, Selena gomez, A ap rocky",A$AP Rocky
One Direction,Drag Me Down,31-Jul-15,"Rock,Pop-Rock,Boy Band,UK,Pop","John ryan, Jamie scott, Julian bunetta",
Jordan Smith,Climb Every Mountain,14-Dec-15,Pop,,
Drake,Back To Back,29-Jul-15,"Canada,Producer,Trap,Beef,Rap",Drake,
Dan + Shay,Nothin' Like You,23-Feb-15,Country,"Ashley gorley, Chris destefano, Shay mooney, Dan smyers",
Luke Bryan,Strip It Down,17-Jul-15,Country,"Ross cooperman, Jon nite, Luke bryan",
"Jordan Smith, Adam Levine",God Only Knows,,Pop,,
Jordan Smith,Somebody To Love,7-Dec-15,Pop,Freddie mercury,
X Ambassadors,Renegades,3-Mar-15,"Pop,Adult Contemporary,Adult Alternative,Alternative Rock,Pop-Rock,Indie Rock,Rock","Sam harris, Adam levin, Casey harris, Alex da kid, Noah feldshuh",
Justin Bieber,Mark My Words,13-Nov-15,"Canada,Pop","Poo bear, Bloodpop, Justin bieber",
Parmalee,Already Callin' You Mine,2-Feb-15,Country,"Wade a kirby, John matthew thomas, Barry franklin knox, Philip eugene odonnell",
G,Random,29-Oct-15,"Pop,West Coast,Rap","Carl sigman, Herbert rehbein, Bert kaempfert, Oz, G eazy",
Justin Bieber,No Pressure,13-Nov-15,"Rap,Canada,Pop","Poo bear, Big sean, Jimmy giannos, Dominic jordan, Justin bieber",Big Sean
Rick Ross,Sorry,9-Oct-15,Rap,"Diego ave, Scott storch, Chris brown, Rick ross",Chris Brown
G,Drifting,19-Nov-15,"R&;B,West Coast,Rap","Chris brown, Cashmere cat, Happy perez, Ellin anderson, David john, Tory lanez",
Fetty Wap,My Way,1-Nov-14,"Hip-Hop,Memes,R&;B,Trap,Rap","Monty, Fetty wap",Monty
Chris Young,I'm Comin' Over,,Country,"Josh hoge, Chris young, Corey crowder",
